ID,CLASS,QUESTION,LEMMA,ANSWER,TAGSET
0,이중전공,"편입생은 이중전공이 안돼요???이번에 들어온 편입생이고, 이중전공신청 들어가니까 학생은 신청대상자가 아니래요??????학교에 전화해도 다들 안받으셔서 여기 물어봐요??","편입 생 은 이중전공 이 안 되 어요 ? ?? 이번 에 들어오 ㄴ 편입 생 이 고 , 이중전공 신청 들어가 니까 학생 은 신청 대상 자 가 아니 래요 ?????? 학교 에 전화 하 어도 다 들 안 받 으시 어서 여기 묻 어 보 어요 ??",,
1,이중전공,글캠인데 중통으로 이중전공 하고싶은데 성적 높아야하나요?,글캠 이 ㄴ데 중통 으로 이중전공 하 고 싶 은데 성적 높 어야 하 나요 ?,,
2,이중전공,이중전공 변경 기간은 5월이고 부전공 신청 기간은 7월 맞죠??!,이중전공 변경 기간 은 5월 이 고 부전공 신청 기간 은 7월 맞 죠 ??!,,
3,이중전공,스페인 이중전공을 경영 부전공으로 바꿀 수 있나요??,스페인 이중전공 을 경영 부전공 으로 바꾸 ㄹ 수 있 나요 ??,,
4,이중전공,서울캠에 너무가고싶은데 전과 보다는 이중전공이쉽나여?? 이중전공은 어떻게하는거애요,서울캠 에 너무 가 고 싶 은데 전과 보다 는 이중전공 이 쉽 나 여 ?? 이중전공 은 어떻 게 하 는 거 애 요,,
5,이중전공,절대평가면 이중전공 신청시 학점에 대한 기준이 아예 없어지는 건가요?,절대 평가 이 면 이중전공 신청 시 학점 에 대하 ㄴ 기준 이 아예 없 어 지 는 거 이 ㄴ가요 ?,,
6,이중전공,경제 이중전공 하려면 시험봐야 하나요?학점은 어느정도 되어야 하나요?,경제 이중전공 하 려면 시험 보 어야 하 나요 ? 학점 은 어느 정도 되 어야 하 나요 ?,,
7,부전공,"현재 국통 부전공상태에서 2학년끝나고 휴학을 할 예정인데, 휴학중일때 국통이중 시험을보고 이중변경 신청을 하려고해요 그럼 학점이 몇 학년 몇학기 성적이 반영되는건가요..?","현재 국 통 부전공 상태 에서 2 학년 끝 나 고 휴학 을 하 ㄹ 예정 이 ㄴ데 , 휴학 중 이 ㄹ 때 국 통 이중 시험 을 보 고 이 중 변경 신청 을 하 려고 하 어요 그럼 학점 이 몇 학년 몇 학기 성적 이 반영 되 는 거 이 ㄴ가요 ..?",,
8,이중전공,이중전공 처음 신청하고 경쟁에 밀려서 불합격하면 포기하고 다음학기나 학년에 다시 지원할 수 있나요?,이중전공 처음 신청 하 고 경쟁 에 밀리 어서 불 합격 하 면 포기 하 고 다음 학기 나 학년 에 다시 지원 하 ㄹ 수 있 나요 ?,,
9,이중전공,"제가지금 부전공을 하고있는데, 변경기간에 다른 전공을 이중전공으로 신청할 수 있나요?","제 가 지금 부전공 을 하 고 있 는데 , 변경 기간 에 다른 전공 을 이중전공 으로 신청 하 ㄹ 수 있 나요 ?",,
10,이중전공,부전공 이중전공은 거의 전필만 듣는다고 보면됨??본전공 전필+전선+교필 채우고 나머지를 이중전공학과 전필로 하면 학점 다 참?,부전공 이중전공 은 거의 전 필 만 듣 는다고 보 면 되 ㅁ ?? 본 전공 전 필 + 전선 + 교 필 채우 고 나머지 를 이중전공 학과 전 필 로 하 면 학점 이 다 참 ?,,
11,이중전공,저 경제 이중전공 너무하고싶은데 학점만 잘따면되나요? 또 필요한거없나요? 검색 다해봤는데도 안나오네요ㅠ,저 경제 이중전공 너무 하 고 싶 은데 학점 만 잘 따 면 되 나요 ? 또 필요 하 ㄴ 거 없 나요 ? 검색 다 해보 었 는데 도 안 나오 네요 ㅠ,,
12,이중전공,편입생인데 이중전공 신청하려면 이번에 몇학점이상 수강신청 해야되는지 제한이 있나요?,편입 생 이 ㄴ 데 이중전공 신청 하 려면 이 번 에 몇 학점 이상 수강 신청 하 어야 되 는지 제한 이 있 나요 ?,,
13,이중전공,사정상 2학기에 입학하는 신입생입니다. 그렇게 되면 21년 2학기에 2학년이 되는데 이중전공을 이때 신청할수도 있나요??,사정 상 2 학기 에 입학 하 는 신입 생 이 ㅂ니다 . 그렇게 되 면 21 년 2 학기 에 2 학년 이 되 는 데 이중전공 을 이때 신청 하 ㄹ 수 도 있 나요 ??,,
14,이중전공,"본전공 어문 이중 어문 질문있습니다!본전공으로 방학때 연수 다녀오면 학점이 인정되는걸로 아는데, 이중전공 어문도 연수다녀오면 전공학점이 인정 되나요? 아니면 인정학점 제한이 있나요?","본 전공 어문 이중 어문 질문 있 습니다 ! 본전 공 으로 방학 때 연수 다녀오 면 학점 이 인정 되 는 거 ㄹ로 알 는데 , 이중전공 어문 도 연수 다녀오 면 전공 학점 이 인정 되 나요 ? 아니면 인정 학점 제한 이 있 나요 ?",,
15,이중전공,이중전공생인데 1학년 전공수업을 들으려고 했는데티오가 아예 없던데 1학년들 다 하고 신청 받는 건지아니면 증원신청을 따로 해서 들을 수 있는 건지 알고싶어요 ㅠㅠ 이중제한은 없었는데 어떻게수강신청을 해야하는 건지 모르겠어요,이중전공 생 이 ㄴ데 1 학년 전공 수업 을 듣 으려고 하 었 는데 티 오 가 아예 없 던데 1 학년 들 다 하 고 신청 받 는 거 이 ㄴ지 아니 면 증원 신청 을 따로 하 어서 듣 을 수 있 는 거 이 ㄴ지 알 고 싶 어요 ㅠㅠ 이 중 제한 은 없 었 는데 어떻게 수강 신청 을 하 어야 하 는 거 이 ㄴ지 모르 겠 어요,,
16,이중전공,"전과햇고 작년에이중전공신청안했는데, 그럼이제 이중 언제신청하나요? 조진건가요","전과햇 고 작년 에 이중전공 신청 안 하 었 는데 , 그럼 이제 이중 언제 신청 하 나요 ? 조진 건가요",,
17,이중전공,이중전공 3학년때부터 들어도 될까요..?1학년 학점으론 원하는 이중전공에 도저히 지원할 수가 없을 거 같아서 그냥 이번에는아무것도 안 했는데.. 그냥 2학년때 자유선택으로 몇 과목 들어놓고3학년때 이중 다시 신청해도 괜찮을까요..? ㅠ찾아보니까 자유선택으로 들은 학점이 나중에 이중으로 변경할 때 인정이 안 되는 경우도 있다고 해서.. ㅠㅠ 어떻게 해야 할지 모르겠습니다 ㅠㅠㅠ,이중전공 3 학년 때 부터 듣 어도 되 ㄹ까요 ..? 1 학년 학점 으로 ㄴ 원하 는 이중전공 에 도저히 지원 하 ㄹ 수 가 없 을 거 같 어서 그냥 이번 에 는 아무것 도 안 하 었 는데 .. 그냥 2 학년 때 자유 선택 으로 몇 과목 듣 어 놓 고 3 학년 때 이 중 다시 신청 하 어도 괜찮 을까요 ..? ㅠ 찾아보 니까 자유 선택 으로 듣 은 학점 이 나중 에 이중 으로 변경 하 ㄹ 때 이 ㄴ 정 이 안 되 는 경우 도 있 다고 하 어서 .. ㅠㅠ 어떻게 하 어야 하 ㄹ지 모르 겠 습니다 ㅠㅠㅠ,,
18,이중전공,이중전공 떨어져서 그 과를 부전공으로 신청해서 됬는데 부전공 수업을 이번학기에 듣는게 나을까요? 전공만 듣는게 나을까요?? (5월에 가능하면 이중전공으로 변경 신청할 예정입니다.),이중전공 떨어지 어서 그 과 를 부전공 으로 신청 하 어서 되 었 는데 부전공 수업 을 이번 학기 에 듣 는 것 이 나 을까요 ? 전공 만 듣 는 것 이 나 을까요 ?? ( 5 월 에 가능 하 면 이중전공 으로 변경 신청 하 ㄹ 예정 이 ㅂ니다 . ),,
19,이중전공,미리 듣는 거 되나요일단 타과거 듣고 이중변경하면 이중전공으로 인정되나요ㅠㅠ제발 알려주세요,미리 듣 는 거 되나요 일단 타 과거 듣 고 이 중 변경 하 면 이중전공 으로 인정 되 나 이 요 ㅠㅠ 제발 알리 어 주 세 요,,
20,이중전공,중언문 이중전공 신청해서 되어있는 상탠데 중외통교차수강과목 듣고 5월달에 이중전공 중외통으로 변경하면 이중 학점으로 인정될까요??,중 언문 이중전공 신청 하 어서 되 어 있 는 상태 이 ㄴ데 중외통교차 수강 과목 듣 고 5 월 달 에 이중전공 중외통 으로 변경 하 면 이중 학점 으로 인정 되 ㄹ까요 ??,,
21,이중전공,하나만 여쭤봐도될까요?ㅜㅜ제가 이중전공도 안하고 부전공신청기간도 놓쳤는데요ㅠㅠ방송 영상 뉴미디어를 이중전공으로 하고싶은데이번 1학기때 전공을 듣고5월에 부전 신청을 해서 2학기말에 이중전공으로 신청넣어도 될까요??ㅠㅠㅠ,하나 만 여쭈 어 보 어도 되 ㄹ까요 ? ㅜㅜ 제가 이중전공 도 안 하 고 부전공 신청 기간 도 놓치 었 는데 요 ㅠㅠ 방송 영상 뉴 미디어 를 이중전공 으로 하 고 싶 은데 이번 1 학기 때 전공 을 듣 고 5 월 에 부전 신청 을 하 어서 2 학기 말 에 이중전공 으로 신청 넣 어도 되 ㄹ까요 ?? ㅠㅠㅠ,,
22,이중전공,"다음학기에 이중전공을 바꾸려고 하는데,이번학기에는 다음학기에 바꿀 이중전공 과목을 자유선택 학점으로 듣고 다음학기에 변경하면 그 자유선택으로 들어갔던 학점이 이중전공 학점으로 변경될 수 있나요..?(학교 수업 관련 게시판을 잠깐 중단해서 메일 넣어놓긴 했는데 연락이 없어서 전화해보려고는 합니다. 그렇지만 혹시 에타에 아시는 분 있을까 해서요!)","다음 학기 에 이중전공 을 바꾸 려고 하 는데 , 이번 학기 에 는 다음 학기 에 바꾸 ㄹ 이중전공 과목 을 자유 선택 학점 으로 듣 고 다음 학기 에 변경 하 면 그 자유 선택 으로 들어가 었 던 학점 이 이중전공 학점 으로 변경 되 ㄹ 수 있 나요 ..? ( 학교 수업 관련 게시판 을 잠깐 중단 하 어서 메일 넣 어 놓 기 ㄴ 하 었 는데 연락 이 없 어서 전화 하 어 보 려고 는 하 ㅂ니다 . 그렇지만 혹시 에타 에 알 시 는 분 있 을까 하 어서 요 ! )",,
23,이중전공,이중전공 한 번 바꿀 수 있는 거죠..?,이중전공 한 번 바꾸 ㄹ 수 있 는 거 이 죠 ..?,,
24,이중전공,부전공으로 들은 전공을 이중전공 신청 기간때 신청해서 합격하면 이중전공으로 바뀌나요 ??,부전공 으로 듣 은 전공 을 이중전공 신청 기간 때 신청 하 어서 합격 하 면 이중전공 으로 바뀌 나요 ??,,
25,이중전공,이중전공 되면 1학년 과목부터 들어야하나요?,이중전공 되 면 1 학년 과목 부터 듣 어야 하 나요 ?,,
26,이중전공,지금 된 이중이 괜찮을지 어떨지모르겠어서 그런데 이중된 상태로 다른전공 부전공으로 듣다가 그거맘에들면 이중변경하고 아니면 부전취소하고 다시 걍 원래있던 이중전공하는거 가능한가요??,지금 되 ㄴ 이중이 괜찮 을지 어떻 ㄹ지 모르 겠 어서 그런데 이 중 되 ㄴ 상태 로 다른 전공 부전공 으로 듣 다가 그거 맘 에 들 면 이중 변경 하 고 아니 면 부전 취소 하 고 다시 걍 원래 있 던 이중전공 하 는 거 가능 하 ㄴ가요 ??,,
27,이중전공,이중전공 결과 나왔어요 ???,이중전공 결과 나오 었 어요 ???,,
28,이중전공,이중 떨어졌는데 부전공으로 신청했다가 그 과를 이중전공으로 변경할 수도 있나요?,이 중 떨어지 었 는데 부전공 으로 신청 하 었 다가 그 과 를 이중전공 으로 변경 하 ㄹ 수 도 있 나요 ?,,
29,이중전공,이중전공도 증원해달라면 받아주는데 있나요..,이중전공 도 증원 하 어 달 라면 받 어 주 는 데 있 나요 ..,,
30,이중전공,이중전공으로 신청한 학과랑 전과한 학과랑 같은데 전과했으면 이중전공은 어떻게 바꾸는지 아시는 분 계신가요ㅠㅠ????,이중전공 으로 신청 하 ㄴ 학과 랑 전과 하 ㄴ 학과 랑 같 은데 전과 하 었 으면 이중전공 은 어떻 게 바꾸 는지 알 시 는 분 계시 ㄴ가요 ㅠㅠ ????,,
31,이중전공,"제가 전공은 독일어이고, 영문과를 이중전공하려 하고 이제 3학년입니다.1영문과에 ‘전공’이라고 써있는 수업들도 수강신청이 가능할까요2 그 수업들이 나중에 이중이 영문과가 확정이 되면 영문과 이중 학점으로 인정이 되나요?3 이중과 전공 1,2,4학년 수업도 신청이 가능한가요?","제 가 전공 은 독일어 이 고 , 영문 과 를 이중전공 하 려 하 고 이제 3 학년 이 ㅂ니다 . 1 영문 과 에 ‘ 전공 ’ 이라고 쓰 어 있 는 수업 들 도 수강 신청 이 가능 하 ㄹ까요 2 그 수업 들 이 나중 에 이중이 영문 과 가 확정 이 되 면 영문과 이중 학점 으로 인정 이 되 나요 ? 3 이중 과 전공 1 , 2 , 4 학년 수업 도 신청 이 가능 하 ㄴ가요 ?",,
32,이중전공,영통 이중전공 떳나요?,영통 이중전공 떳나 요 ?,,
33,이중전공,시간표에 1학년 과목하고 이중전공만 넣었는데 나만 그런 거임? 기본도 모르면서 2학년 거 들으면 ㅈ망할 것 같은데,시간표 에 1 학년 과목 하고 이중전공 만 넣 었 는데 나 만 그렇 ㄴ 거 이 ㅁ ? 기본 도 모르 면서 2 학년 거 듣 으면 ㅈ 망하 ㄹ 것 같 은데,,
34,이중전공,저는 글캠 통번역대에서 서울캠 아시아언어문화대로 전과한 19학번입니다.전과하기 전 학과에서 전공을 24학점 이수하여 전과한 후 24학점이 모두 자선으로 변경된 상태입니다.1. 자선학점을 교양학점으로 변경할 수 있다는 것을 수강편람에서 봐서 12학점을 교양으로 넘길 예정입니다. 2. 그리고 전과하기 전 학과의 언어를 서울캠에서 이중전공으로 하고 싶은데 이제 가능할지가 일단 궁금합니다.3. 만약 가능하다면 교양으로 12학점을 넘기고 남은 자선 12학점 중 6학점을 이중전공으로 넘기고 싶은데 이것도 가능할까요? 이게 가능할 거라고 생각한 이유는 전과하기 전 학과의 언어와 이중전공의 언어가 같기 때문입니다. 그리고 제가 받은 자선학점은 모두 한 언어에 대한 학점이고요.,저 는 글 캠 통번역대 에서 서울 캠 아시아 언어 문화 대로 전과 하 ㄴ 19 학번 이 ㅂ니다 . 전과 하 기 전 학과 에서 전공 을 24 학점 이수 하 여 전과 하 ㄴ 후 24 학점 이 모두 자선 으로 변경 되 ㄴ 상태 이 ㅂ니다 . 1 . 자선 학점 을 교양 학점 으로 변경 하 ㄹ 수 있 다는 것 을 수강편람 에서 보 어서 12 학점 을 교양 으로 넘기 ㄹ 예정 이 ㅂ니다 . 2 . 그리고 전과 하 기 전 학과 의 언어 를 서울캠 에서 이중전공 으로 하 고 싶 은 데 이제 가능 하 ㄹ지 가 일단 궁금 하 ㅂ니다 . 3 . 만약 가능 하 다면 교양 으로 12 학점 을 넘기 고 남은 자선 12 학점 중 6 학점 을 이중전공 으로 넘기 고 싶 은데 이것 도 가능 하 ㄹ까요 ? 이 게 가능 하 ㄹ 거 이 라고 생각 하 ㄴ 이유 는 전과 하 기 전 학과 의 언어 와 이중전공 의 언어 가 같 기 때문 이 ㅂ니다 . 그리고 제 가 받 은 자선 학점 은 모두 한 언어 에 대하 ㄴ 학점 이 고요 .,,
35,이중전공,정외 이중전공 결과 안뜬거 맞지 아직 ?,정 외 이중전공 결과 안 뜨 ㄴ 거 맞 지 아직 ?,,
36,이중전공,이중전공 1학기 마치고 신청할 수 있어요?,이중전공 1 학기 마치 고 신청 하 ㄹ 수 있 어요 ?,,
37,이중전공,이번에 3학년 복학인데 이중전공 부전공으로 내리는 기간 언제인가요..??,이번 에 3 학년 복학 이 ㄴ 데 이중전공 부전공 으로 내리 는 기간 언제 이 ㄴ가요 ..??,,
38,이중전공,이중전공 발표난 과 있나용...?,이중전공 발표 난 과 있 나 용 ...?,,
39,이중전공,(이제 2학년 입니다)이중전공 일단 신청은 해뒀지만 벌써 바꾸고 싶은데정정기간까지 한학기? 두학기? 기다려야 되니까그 때 동안 신청해둔 이중전공에 대한 과목을 수강신청안하고 안들으면 되는거죠?,( 이제 2 학년 이 ㅂ니다 ) 이중전공 일단 신청 은 하 어 두 었 지만 벌써 바꾸 고 싶 은데 정정 기간 까지 한 학기 ? 두 학기 ? 기다리 어야 되 니까 그 때 동안 신청 하 어 두 ㄴ 이중전공 에 대하 ㄴ 과목 을 수강 신청 안 하 고 안 듣 으면 되 는 거 이 죠 ?,,
40,이중전공,이중전공 바꾸면 전에 듣던 이중전공 학점음 자선  된다는게 무슨 소리에요?,이중전공 바꾸 면 전 에 듣 던 이중전공 학점 음 자선 되 ㄴ다는 것 이 무슨 소리 이 에요 ?,,
41,이중전공,이중전공 변경 언제하시는지 아는분?,이중전공 변경 언제 하 시 는지 알 는 분 ?,,
42,이중전공,경영 이중전공2학년 때 부전공으로 경영듣고 3학년 때 이중전공으로 신청하려구 하는데 이중전공 시험볼 때 도움되는 과목은 어떤게 있을까요??ㅎㅎ,경영 이중전공 2 학년 때 부전공 으로 경영 듣 고 3 학년 때 이중전공 으로 신청 하 려구 하 는데 이중전공 시험 보 ㄹ 때 도움 되 는 과목 은 어떤 게 있 을까요 ?? ㅎㅎ,,
43,이중전공,혹시 lt 이중전공하시는 분 계신가요? 질문하고 싶은 게 있는데 있으시다면쪽지부탁드립니다ㅠㅠ,혹시 lt 이중전공 하 시 는 분 계시 ㄴ가요 ? 질문 하 고 싶 은 게 있 는 데 있 으시 다면 쪽지 부탁 드리 ㅂ니다 ㅠㅠ,,
44,이중전공,"궁금한 게 있는데요,국제학부 같은 경우는 이중전공도 원래 전공과 전필이 똑같은가요??그리고, 다 1,2학기 모두 국제학부는 학년이 1학년으로만 되어있던데 그 커리큘럼을 그대로 3,4학년때도 하는 건가요...? ??알려주세요~~!!ㅠ","궁금 하 ㄴ 게 있 는데요 , 국제 학부 같 은 경우 는 이중전공 도 원래 전공 과 전 필 이 똑같 은 가 요 ?? 그리고 , 다 1 , 2 학기 모두 국제 학부 는 학년 이 1 학년 으로 만 되 어 있 던데 그 커리큘럼 을 그대로 3 , 4 학년 때 도 하 는 거 이 ㄴ가요 ...? ?? 알리 어 주 시 어요 ~~ !! ㅠ",,
45,이중전공,교육학 이중전공은 없나요? ㅠㅠㅠ,교육학 이중전공 은 없 나요 ? ㅠㅠㅠ,,
46,이중전공,이중전공 결과 언제 나와요?,이중전공 결과 언제 나오 어요 ?,,
47,이중전공,정치외교 이중전공 하신 선배님들 한번만 도와주세용 ㅠㅠㅠㅠㅠㅠㅠ,정치 외교 이중전공 하 시 ㄴ 선배 님 들 한 번 만 도와주 세 용 ㅠㅠㅠㅠㅠㅠㅠ,,
48,이중전공,중통이중전공 혼자 하는데 다니기 어렵네요.. 내년엔 또 어떻게 해야좋을지 막막쓰^^,중통 이중전공 혼자 하 는 데 다니 기 어렵 네요 .. 내년 에 ㄴ 또 어떻게 하 어야 좋 을지 막막 쓰 ^^,,
49,이중전공,정치외교 이중전공 면접 언제 뜨나요 ㅠ,정치 외교 이중전공 면접 언제 뜨 나요 ㅠ,,
50,이중전공,이중전공 신청 기간 착각하고 신청 못했는데 다른 방법이 있을까요ㅠㅠㅠㅠㅠ??,이중전공 신청 기간 착각 하 고 신청 못 하 었 는데 다른 방법 이 있 을까요 ㅠㅠㅠㅠㅠ ??,,
51,이중전공,만약 전과를 생각중이라면 이중전공 신청을 안하는게 맞을까요?,만약 전과 를 생각 중 이 라면 이중전공 신청 을 안 하 는 것 이 맞 을까요 ?,,
52,이중전공,<독통 이중전공을 신청했습니다>1. 원래 독통을 부전공으로 하려고 했는데 신청기간 안에 뭐라도 기입하긴 해야할 것 같아 이중으로 넣었습니다. 추후에 부전공으로 변경 가능한가요?2. 독일어는 어느 정도로 준비해야 커리큘럼 따라잡을 수 있나요?,< 독 통 이중전공 을 신청 하 었 습니다 > 1 . 원래 독 통 을 부전공 으로 하 려고 하 었 는데 신청 기간 안 에 뭐 이 라도 기입 하 기 ㄴ 하 어야 하 ㄹ 것 같 어 이중 으로 넣 었 습니다 . 추후 에 부전공 으로 변경 가능 하 ㄴ가요 ? 2 . 독일어 는 어느 정도 로 준비 하 어야 커리큘럼 따라잡 을 수 있 나요 ?,,
53,이중전공,전자공학이랑 컴공 중이중전공뭐할까요 어디가 더 나을까요 자대인데ㅠ,전자공학 이랑 컴 공 중 이중전공 뭐 하 ㄹ까요 어디 가 더 낫 을까요 자대 이 ㄴ데 ㅠ,,
54,이중전공,공무원이나 공기업쪽 생각하고있는데 이중전공으로 경영이 나을까요 경제가 나을까요?,공무원 이나 공기업 쪽 생각 하 고 있 는 데 이중전공 으로 경영 이 낫 을까요 경제 가 낫 을까요 ?,,
55,이중전공,설캠에서 융소 이중전공하면 글캠으로 수업들으러가야되나요..?,설캠 에서 융 소 이중전공 하 면 글캠 으로 수업 듣 으러 가 어야 되 나요 ..?,,
56,이중전공,이중전공이 취소신청도안했는데 사라진건 어떻게된일이죠?? 수업을안들었다고 그럴수있나요??,이중전공 이 취소 신청 도 안 하 었 는데 사라지 ㄴ 거 ㄴ 어떻게 되 ㄴ 일 이 죠 ?? 수업 을 안 듣 었 다고 그러 ㄹ 수 있 나요 ??,,
57,이중전공,부전공하다가 다른 이중전공 신청 가능한가요?예를들면 경영부전공하다가 다음 이중전공 신청기간때 융소이중전공 신청 가능한가요??만약에 된다면 기존에 하던 부전공 하던건 어떻게 되나요?~??,부전공 하 다가 다른 이중전공 신청 가능 하 ㄴ가요 ? 예 를 들 면 경영 부전공 하 다가 다음 이중전공 신청 기간 때 융소 이중전공 신청 가능 하 ㄴ가요 ?? 만약 에 되 ㄴ다면 기존 에 하 던 부전공 하 던 거 ㄴ 어떻게 되 나요 ? ~ ??,,
58,이중전공,34학점 미만인 사람은 이중전공변경신청때 신청하는게 최선이겠네요??경영 이중하려면ㅠㅠ,34 학점 미만 이 ㄴ 사람 은 이중전공 변경 신청 때 신청 하 는 것 이 최선 이 겠 네요 ?? 경영 이 중하 려면 ㅠㅠ,,
59,이중전공,이중전공신청에 순번은 무슨 의미인가요?,이중전공 신청 에 순번 은 무슨 의미 이 ㄴ가요 ?,,
60,이중전공,eicc 이중전공 장단점 알려주세요!,eicc 이중전공 장단점 알리 어 주 시 어요 !,,
61,이중전공,이중전공은 국제금융 어렵나요??,이중전공 은 국제 금융 어렵 나요 ??,,
62,부전공,"글캠 공대 재학중인데 설캠 경영으로 전과 생각중입니다! 1. 경영 전과 자격요건인 34학점 이상 평점 3.5, 토익 800 이상이면 지원자격은 주어지는 것 맞죠? 전과성공하려면 학점 4.0은 넘어야한다는 분들이 많았던거같아서 여쭤봅니다2. 전출한 과로 이중 및 부전공이 불가능한걸로 알고있는데 설캠 경영으로 간 다음 융합소프트웨어전공으로 공학쪽도 계속할 수 있을까요?","글 캐 ㅁ 공대 재학 중 이 ㄴ데 설 캠 경영 으로 전과 생각 중 이 ㅂ니다 ! 1 . 경영 전과 자격 요건 이 ㄴ 34 학점 이상 평점 3 . 5 , 토익 800 이상 이 면 지원 자격 은 주어지 는 것 맞 죠 ? 전과 성공 하 려면 학점 4 . 0 은 넘 어야 하 ㄴ다는 분 들 이 많 었 던 거 같 어서 여쭈 어 보 ㅂ니다 2 . 전출 하 ㄴ 과로 이중 및 부전공 이 불 가능 하 ㄴ 거 ㄹ로 알 고 있 는데 서 ㄹ 캠 경영 으로 가 ㄴ 다음 융합 소프트웨어 전공 으로 공학 쪽 도 계속 하 ㄹ 수 있 을까요 ?",,
63,이중전공,국제학부 이중 하시는 분 후기 궁금합니다 ㅠㅠ공부하는 분야가 다양하다보니까 조금 애매하지 않나 고민이 되기도 하고 ㅠㅠ본전공은 서양어대이고 이중전공 국통이랑 국제학부랑 고민 중입니다,국제 학부 이중 하 시 는 분 후기 궁금 하 ㅂ니다 ㅠㅠ 공부 하 는 분야 가 다양 하 다 보 니까 조금 애매 하 지 않 나 고민 이 되 기 도 하 고 ㅠㅠ 본 전공 은 서양어대 이 고 이중전공 국통 이 랑 국제학부 랑 고민 중 이 ㅂ니다,,
64,이중전공,글캠인데 서울에 있는 영어과 대학으로는 전부 이중전공 안되는건가요??,글캠 이 ㄴ데 서울 에 있 는 영어 과 대학 으로 는 전부 이중전공 안 되 는 거 이 ㄴ가요 ??,,
65,이중전공,1학년 1학기에 학고받으면 이중전공 신청 못하나요???,1 학년 1 학기 에 학고 받 으면 이중전공 신청 못 하 나요 ???,,
66,부전공,융소 이중 신청할 때 학점 컷 같은거 있나요..? 부전공으로 신청 되는지도 궁금합니다 ㅠㅠ어디서 찾아봐야 할지도 모르겠구요,융 소 이중 신청 하 ㄹ 때 학점 컷 같 은 거 있 나요 ..? 부전공 으로 신청 되 는지 도 궁금 하 ㅂ니다 ㅠㅠ 어디 서 찾아보 어야 하 ㄹ지 도 모르 겠 구요,,
67,이중전공,부전공했다가 이중전공으로 올리면 부전공때 들었던 학점은 이중전공 학점으로 옮겨지나요?,부전공 하 었 다가 이중전공 으로 올리 면 부전공 때 듣 었 던 학점 은 이중전공 학점 으로 옮기 어 지 나요 ?,,
68,이중전공,1전공이 소수언어고 이중전공 통대 하는거 어때요?,1 전공 이 소수언어 이 고 이중전공 통 대 하 는 거 어떻 어요 ?,,
69,이중전공,GBT 1전공생은 주로 이중전공 뭐하나요??,GBT 1 전 공생 은 주로 이중전공 뭐 하 나요 ??,,
