ID,CLASS,QUESTION,LEMMA,ANSWER,TAGSET
1626,이중전공,조교님 안녕하세요!!제 1전공은 공대쪽이고 이중전공으로 영어통번역학을 듣고 있습니다영어통번역학에서 세부전공으로 영어통번역을 신청했었는데요2019-1학기때 수강신청 시 영미권통상통번역과목 비고란에 세부전공인정이라고 써져있는 과목을 들었었는데 세부전공으로 돌리려면 따로 이수변경이 필요한가요?,조교 님 안녕하세요 !! 제 1 전공 은 공대 쪽 이 고 이중전공 으로 영어 통 번역학 을 듣 고 있 습니다 영어 통 번역학 에서 세부 전공 으로 영어 통 번역 을 신청 하 었었 는데요 2019 - 1 학기 때 수강 신청 시 영미 권 통상 통 번역 과목 비고 란 에 세부 전공 인정 이 라고 쓰 어 지 어 있 는 과목 을 듣 었었 는데 세부 전공 으로 돌리 려면 따로 이수 변경 이 필요 하 ㄴ가요 ?,,
1627,이중전공,"안녕하세요 에타조교님!!제가 편입생이라 학번은 16이고 이번에 미컴 - 언론정보로 이중전공변경승인을 받았습니다미컴학부 홈페이지에 따르면, 이중전공생과 이중전공변경생의 전공필수 수강의무가 사진과 같이 나와있는데이중승인 변경년도에 상관없이 18이후 학번인인 저는 전공필수의무에 해당되지 않는거죠?혼란스러워 글 남깁니다","안녕하세요 에 타 조교 님 !! 제가 편입 생 이 라 학번 은 16 이 고 이번 에 미 컴 - 언론 정보 로 이중전공 변경 승인 을 받았습니다미컴 학부 홈페이지 에 따르 면 , 이중전공 생 과 이중전공 변경 생 의 전공 필수 수강 의무 가 사진 과 같이 나오 어 있 는데 이 중 승인 변경 년도 에 상관없이 18 이후 학번 이 ㄴ 이 ㄴ 저 는 전공 필수 의무 에 해당 되 지 않 는 거 이 죠 ? 혼란 스럽 어 글 남기 ㅂ니다",,
1628,이중전공,"안녕하세요 조교님! 항상 수고하십니다.저는 1학년이고 사범대생입니다. 이번 2학기 수강편람에서 핵심인문기초가 2학점으로 줄었는데, 1학기 때 핵심인문기초를 4학점이나 들어놓아서 핵인기 2학점이 쓸모없어져버렸어요. 그렇지만 일단 학점으로는 인정되는지가 궁금합니다. 제가 1학기 때 핵인기 포함 17학점을 들었었는데, 이월예상학점이 3학점인 것으로 보아 인정은 된 것 같습니다만 이중전공 때문에 불안해서 문의드립니다.","안녕하세요 조교 님 ! 항상 수고 하 시 ㅂ니다 . 저 는 1 학년 이 고 사범대 생 이 ㅂ니다 . 이번 2 학기 수강편람 에서 핵심 인문 기초 가 2 학점 으로 줄 었 는데 , 1 학기 때 핵심 인문 기초 를 4 학점 이나 들 어 놓 어서 핵 인기 2 학점 이 쓸모없 어 지 어 버리 었 어요 . 그렇지만 일단 학점 으로 는 인정 되 는지 가 궁금 하 ㅂ니다 . 제가 1 학기 때 핵 인기 포함 17 학점 을 듣 었었 는데 , 이 월 예상 학점 이 3 학점 이 ㄴ 것 으로 보 어 인정 은 되 ㄴ 것 같 습니다만 이중전공 때문 에 불안 하 어서 문의 드리 ㅂ니다 .",,
1629,이중전공,"안녕하세요 조교님! 이번2학기 휴학 예정인 1학년입니다..개인 사정으로 휴학하는거여서 내년1학기에 엇학기로 복학 예정입니다,,,,이렇게 내년 1학기에 1-2를 마치고 이중전공신청을 하게 되면 많이 불리한가요,,? 티오가 많이 없다던지 경쟁률이 더 치열하다던지 등등,,,요약하자면, 엇학기 복학생은 이중전공 신청할때 불이익이 있는지 궁금합니다","안녕하세요 조교 님 ! 이번 2 학기 휴학 예정 이 ㄴ 1 학년 이 ㅂ니다 .. 개인 사정 으로 휴학 하 는 거 이 어서 내년 1 학기 에 엇학기 로 복학 예정 이 ㅂ니다 ,,,, 이렇 게 내년 1 학기 에 1 - 2 를 마치 고 이중전공 신청 을 하 게 되 면 많이 불리 하 ㄴ가요 ,, ? 티오 가 많이 없 다 던지 경쟁 률 이 더 치열 하 다 던지 등등 ,,, 요약 하 자면 , 엇 학기 복학 생 은 이중전공 신청 하 ㄹ 때 불 이익 이 있 는지 궁금 하 ㅂ니다",,
1630,부전공,"안녕하세요 조교님! 이번 학기에 휴학하려고 하는 17학번입니다.제가 이번 이중변경기간에 신청을 했다가 떨어져서 부전공으로 그 과목을 신청했습니다. 그래서 부전으로 배정받긴 했는데 아무리 생각해도 아닌것같아서 부전을 또 변경하고 싶어서요ㅠㅠ 이미 한번 이중을 부전으로 바꿨는데, 그 부전공 선택한걸 취소하고 다른 전공으로 부전공 변경 신청이 가능한가요?? (이중->부전->또 다른걸로 부전신청)그리고 휴학을 하면 휴학한 그 학기에는 부전공 변경이 안된다는 소리를 들어서 여쭤보려고 합니다ㅠㅠ 꼭 복학 후에만 부전공을 다른걸로 바꿀 수 있나요??","안녕하세요 조교 님 ! 이번 학기 에 휴학 하 려고 하 는 17 학번 이 ㅂ니다 . 제 가 이번 이중 변경 기간 에 신청 을 하 었 다가 떨어지 어서 부전공 으로 그 과목 을 신청 하 었 습니다 . 그래서 부전 으로 배정 받 기 ㄴ 하 었 는데 아무리 생각 하 어도 아니 ㄴ 것 같 어서 부전 을 또 변경 하 고 싶 어서요 ㅠㅠ 이미 한 번 이 중 을 부전 으로 바꾸 었 는데 , 그 부전공 선택 하 ㄴ 거 ㄹ 취소 하 고 다른 전공 으로 부전공 변경 신청 이 가능 하 ㄴ가요 ?? ( 이중 - > 부전 - > 또 다른 거 ㄹ로 부전 신청 ) 그리고 휴학 을 하 면 휴학 하 ㄴ 그 학기 에 는 부전공 변경 이 안 되 ㄴ다는 소리 를 듣 어서 여쭈 어 보 려고 하 ㅂ니다 ㅠㅠ 꼭 복학 후 에 만 부전공 을 다른 거 ㄹ로 바꾸 ㄹ 수 있 나요 ??",,
1631,이중전공,안녕하세요 조교님 수강신청 중 궁금한게 생겨서 질문 남겨요:)제가 이중전공이 생명공학과인데 교양과목 중 '생명의 출현과 진화'과목을 듣고싶은데 비고란에 '생명공학과 수강금지'라고 적혀있더라고요...그러면 저는 수강할 수 없는건가요 아니면 본전공만 수강금지인 것인가요...??,안녕하세요 조교 님 수강 신청 중 궁금 하 ㄴ 게 생기 어서 질문 남기 어요 : ) 제가 이중전공 이 생명 공학 과 이 ㄴ데 교양 과목 중 ' 생명 의 출현 과 진화 ' 과목 을 듣 고 싶 은데 비고 란 에 ' 생명 공학 과 수강 금지 ' 라고 적히 어 있 더라고요 ... 그러면 저 는 수강 하 ㄹ 수 없 는 거 이 ㄴ가요 아니면 본 전공 만 수강 금지 이 ㄴ 것 이 ㄴ가요 ...??,,
1632,이중전공,"안녕하세요 조교님!?? 타 과 수강신청에 궁금한 점이 있어 문의드립니다ㅎ현재 이중전공을 지난학기에 바꾸지 못하고 이번 학기에 변경하려고 해서, 다른 이중전공으로 등록되어있는 상태로 이번학기에 변경할 과의 강의를 미리 신청하려 합니다.이렇게 완전히 타과생인 상태로 비고란에 이중전공 및 재수강, 외국인 학생 수강이라고 적혀있는 과목을 수강신청가능한지 묻고 싶습니다!!방학에도 정말정말 수고 많으십니다! 감사해요ㅎㅎ","안녕하세요 조교 님 !?? 타 과 수강 신청 에 궁금 하 ㄴ 점 이 있 어 문의 드리 ㅂ니다 ㅎ 현재 이중전공 을 지나 ㄴ 학기 에 바꾸 지 못하 고 이번 학기 에 변경 하 려고 하 어서 , 다른 이중전공 으로 등록 되 어 있 는 상태 로 이번 학기 에 변경 하 ㄹ 과 의 강의 를 미리 신청 하 려 하 ㅂ니다 . 이렇 게 완전히 타과생 이 ㄴ 상태 로 비고 이 란 에 이중전공 및 재수강 , 외국인 학생 수강 이 라고 적히 어 있 는 과목 을 수강 신청 가능 하 ㄴ지 묻 고 싶 습니다 !! 방학 에 도 정말 정말 수고 많 으시 ㅂ니다 ! 감사 해요 ㅎㅎ",,
1633,이중전공,"안녕하세요 조교님!방학에도 이렇게 답해주셔서 정말정말 감사드립니다저는 3학년 1학기를 마치고 이번 학기(3-2)는 휴학상태입니다 1학년 때 이중전공을 신청하지 않고 부전공만 신청했는데, 혹시 아예 다른 과 이중전공을 신청할 수 있는 기회는 이제 없는 건가요? 후기이중전공신청 대상에 포함되는 지 궁금합니다 !","안녕하세요 조교 님 ! 방학 에 도 이렇 게 답 하 어 주 시 어서 정말 정말 감사 드리 ㅂ니다 저 는 3 학년 1 학기 를 마치 고 이번 학기 ( 3 - 2 ) 는 휴학 상태 이 ㅂ니다 1 학년 때 이중전공 을 신청 하 지 않 고 부전공 만 신청 하 었 는데 , 혹시 아예 다른 과 이중전공 을 신청 하 ㄹ 수 있 는 기회 는 이제 없 는 거 이 ㄴ가요 ? 후기 이중전공 신청 대상 에 포함 되 는 지 궁금 하 ㅂ니다 !",,
1634,부전공,안녕하세요 조교님! 궁금한게 있어서 물어보려고 합니다..!제가 공대생인데 공대쪽 학부를 부전공을 하려하는데 만약 본전공 전공과목과 부전공 전공과목이 교류가 되면 학점이 동시 인정이 되는건가요..? 예를 들어 컴전학부의 '자료구조'과목이 바메공학부의 '자료구조'가 전공교류가 되는데 1번만 수강하면 본전공과 부전공 전공으로 인정되서 6학점으로 인정이 되나요..? 만약 아니라면 부전공학점을 본전공과 겹치는 과목을 제외하고 채워야하는건가요..?다소 두서없는 말이지만 답변해주시면 감사하겠습니다:),안녕하세요 조교 님 ! 궁금 하 ㄴ 게 있 어서 묻 어 보 려고 하 ㅂ니다 ..! 제가 공대 생 이 ㄴ데 공대 쪽 학부 를 부전공 을 하 려 하 는 데 만약 본 전공 전공과목 과 부전공 전공 과목 이 교류 가 되 면 학점 이 동시 인정 이 되 는 거 이 ㄴ가요 ..? 예 를 들 어 컴전학부 의 ' 자료 구조 ' 과 목이 바메공학부 의 ' 자료 구조 ' 가 전공 교류 가 되 는데 1 번 만 수강 하 면 본전 공과 부전공 전공 으로 인정 되 서 6 학점 으로 인정 이 되 나요 ..? 만약 아니 라면 부전공 학점 을 보 ㄴ 전공 과 겹치 는 과목 을 제외 하 고 채우 어야 하 는 거 이 ㄴ가요 ..? 다소 두서없 는 말 이 지만 답변 하 어 주 시 면 감사 하 겠 습니다 : ),,
1635,이중전공,이중전공 부전공으로 내리는 신청기간이 언제인가요?,이중전공 부전공 으로 내리 는 신청 기간 이 언제 이 ㄴ가요 ?,,
1636,부전공,"조교님 안녕하십니까 ! 늘 고생많으십니다.후기이중에 대해 질문 드리고 싶습니다.후기이중이 7학기째(4월) 에 신청을 하고 8학기 수료했을때 부전공 학점을 다 채웠을때 승인이 나면 후기이중이 되는걸로 알고있는데만약 7학기째 (20년도 1학기)에 교환학생을 간후 , 20년도 2학기에 휴학을 하는 경우는 어떻게 해야하나요(이때는 부전공 학점을 다 채우지못했습니다) ?? 4월에 신청하지만 저에게는 21년도 1학기가8학기째라서.. 언제 신청을 해야하고 언제 승인이 나는건가요 ????감사합니다.","조교 님 안녕하십니까 ! 늘 고생 많 으시 ㅂ니다 . 후기 이중 에 대하 어 질문 드리 고 싶 습니다 . 후기 이중이 7 학기 째 ( 4 월 ) 에 신청 을 하 고 8 학기 수료 하 었 을 때 부전공 학점 을 다 채우 었 을 때 승인 이 나 면 후기이중 이 되 는 거 ㄹ로 알 고 있 는 데 만약 7 학기 째 ( 20 년도 1 학기 ) 에 교환 학생 을 가 ㄴ 후 , 20년 도 2 학기 에 휴학 을 하 는 경우 는 어떻게 하 어야 하 나요 ( 이 때 는 부전공 학점 을 다 채우 지 못하 었 습니다 ) ?? 4월 에 신청 하 지만 저 에게 는 21 년도 1 학기 가 8 학기 째 이 라서 .. 언제 신청 을 하 어야 하 고 언제 승인 이 나 는 거 이 ㄴ가요 ???? 감사 하 ㅂ니다 .",,
1637,이중전공,"조교님 안녕하세요! 바쁘실텐데 죄송하고 고맙습니당??저는 1전공이 아시아언어문화대학, 2전공이 eicc인데요 eicc가 1전공이 아닌 이중전공이라고 하더라도 영어대교류로 타과 수업을 듣고 학점 인정을 받을 수 있는 것인가요?만약 가능하다면 수강신청 때 어느 날 어떻게 신청해야 하는지 알려주시면 감사하겠습니다.(체크란이 있는지, 별다른 유의사항은 없는지)","조교 님 안녕하세요 ! 바쁘 시 ㄹ 터 이 ㄴ데 죄송 하 고 고맙습니 당 ?? 저 는 1 전공 이 아시아 언어 문화 대학 , 2 전공 이 eicc 이 ㄴ데요 eicc 가 1 전공 이 아니 ㄴ 이중전공 이 라고 하 더라도 영어 대 교류 로 타 과 수업 을 듣 고 학점 인정 을 받 을 수 있 는 것 이 ㄴ가요 ? 만약 가능 하 다면 수강 신청 때 어느 날 어떻게 신청 하 어야 하 는지 알리 어 주 시 면 감사 하 겠 습니다 . ( 체크란 이 있 는지 , 별다르 ㄴ 유의 사항 은 없 는지 )",,
1638,이중전공,"안녕하세요 조교님, 학생들의 궁금증 해소를 위해 불철주야 고생이 많으십니다. 다름이 아니고, 이중전공과 관련해 여쭤볼 것이 있습니다. 저는 1학년 2학기 때 이중전공 신청을 하지 않았습니다. 현재 2학년 1학기 까지 수료한 상황인데, 이중전공을 신청하고 싶어졌습니다. 저 같은 경우에도 이중전공을 신청할 수 있을까요? 만약 된다면 신청기간은 언제부터 언제까지인가요?(요구하는 학점은 충족한 상태입니다.)","안녕하세요 조교 님 , 학생 들 의 궁금증 해소 를 위하 어 불 철 주야 고생 이 많 으시 ㅂ니다 . 다르 ㅁ 이 아니 고 , 이중전공 과 관련 하 어 여쭈 어 보 ㄹ 것 이 있 습니다 . 저 는 1 학년 2 학기 때 이중전공 신청 을 하 지 않 었 습니다 . 현재 2 학년 1 학기 까지 수료 하 ㄴ 상황 이 ㄴ데 , 이중전공 을 신청 하 고 싶 어 지 었 습니다 . 저 같 은 경우 에 도 이중전공 을 신청 하 ㄹ 수 있 을까요 ? 만약 되 ㄴ다면 신청 기간 은 언제 부터 언제 까지 이 ㄴ가요 ? ( 요구 하 는 학점 은 충족 하 ㄴ 상태 이 ㅂ니다 . )",,
1639,부전공,14학번 영어대 졸업요건 이게 맞나요?영어어학점수기타어학점수(한자or한국어or제2외국어)학점-전공54 부전공21 실외(교양외국어)4 +그외필수과목이수-남는 학점은 아무거나(타과과목포함) 채워서 134이수,14 학번 영어 대 졸업 요건 이 게 맞 나요 ? 영어 어학 점수 기타 어학 점수 ( 한자 or 한국어 or 제 2 외국어 ) 학점 - 전공 54 부전공 21 실외 ( 교양 외국어 ) 4 + 그 외 필수 과목 이수 - 남 는 학점 은 아무 거 나 ( 타과과목 포함 ) 채우 어서 134 이수,,
1640,이중전공,조교님 안녕하세요! 현재 영어대학에서 1전공 2전공을 모두 하고 있습니다. 이중전공 학점 인정과 관련하여 여쭤볼 것이 있습니다.저는 두 전공 모두 영어대에 속하기 때문에 영어대 교류를 통해 수업을 수강할 수 있습니다. 혹시 1전공에서 영어대 교류라고 적힌 수업을 듣고 2전공으로 교류 신청을 해서 학점인정을 받을 수 있나요? 물론 이중전공 전용수업이 아닌 본전공 전용수업으로 할 예정입니다.확인 부탁드립니다. 감사합니다.,조교 님 안녕하세요 ! 현재 영어 대학 에서 1 전공 2 전공 을 모두 하 고 있 습니다 . 이중 전공 학점 인정 과 관련 하 어 여쭈 어 보 ㄹ 것 이 있 습니다 . 저 는 두 전공 모두 영어 대 에 속하 기 때문 에 영어 대 교류 를 통하 어 수업 을 수강 하 ㄹ 수 있 습니다 . 혹시 1 전공 에서 영어 대 교류 이 라고 적히 ㄴ 수업 을 듣 고 2 전공 으로 교류 신청 을 하 어서 학점 인정 을 받 을 수 있 나요 ? 물론 이중전공 전용 수업 이 아니 ㄴ 본 전공 전용 수업 으로 하 ㄹ 예정 이 ㅂ니다 . 확인 부탁 드리 ㅂ니다 . 감사 하 ㅂ니다 .,,
1641,부전공,"조교님 안녕하세요!이수영영 변경 관련하여 문의드립니다현재 졸업까지 6학점이 남은상황에 영역별 최소이수학점 영역중 교양영역이 1학점이 부족한 상태입니다. 하지만 자선이 15학점, 기타 전공과 부전공은 최소이수학점을 초과한 상태인데요이럴경우 자선이나 전공 및 부전공의 이수학점을 교양영역으로 바꾸는 것이 가능한지요? 자선의 경우 기존에 들었던 다른 부전공 과목들이 자선으로 넘어갔습니다. 감사합니다!","조교 님 안녕하세요 ! 이수영 영 변경 관련 하 어 문의 드리 ㅂ니다 현재 졸업 까지 6 학점 이 남 은 상황 에 영역 별 최소 이수 학점 영역 중 교양 영역 이 1 학점 이 부족 하 ㄴ 상태 이 ㅂ니다 . 하지만 자선 이 15 학점 , 기타 전공 과 부전공 은 최소 이수 학점 을 초과 하 ㄴ 상태 이 ㄴ데요 이러 ㄹ 경우 자선 이나 전공 및 부전공 의 이수 학점 을 교양 영역 으로 바꾸 는 것 이 가능 하 ㄴ 지요 ? 자선 의 경우 기존 에 들 었 던 다른 부전공 과목 들 이 자선 으로 넘어가 었 습니다 . 감사 하 ㅂ니다 !",,
1642,부전공,안녕하세요 조교님 :) 여름 잘 보내시고 계신가요??이렇게 게시판에 글 달아주시고 도움주셔서 항상 정말 너무 감사드립니다.다름이 아니라 제가 지금 도저히 부전공A가 너무 맞지 않아 부전공B 바꾸려고 합니다.1) 이 경우에도 5월 / 11월로 알고 있는 이중(?) 부전공 변경 신청 때 변경 가능한 건가요?2) 이 경우도 (부전공에서 부전공으로 바뀌지만) 바꾸려는 부전공에 따라 학점이나 티오 등의 제한이 있나요? (이중변경 시 제한이 있어 여쭙니다!) 3) 부전공B로 변경 후 나중에 이 B를 후기 이중이나 기회를 통해 이중 전공으로 올릴 기회가 주어질까요?ㅠ (부전공 A> 부전공 B 변경시 부전공 B로 고정일까요?ㅠ)4) 바꿀 부전공B의 학점을 미리 인정 받을 방법이 있을까요?너무 많은 질문을 드린 것 같아 죄송합니다.주변에서는 부전공인데 왜 이렇게 연연하냐 그냥 듣고 잘 졸업하라 등의 말이 많은데 제게 너무 맞지 않아 고민에 고민 끝네 이렇게 글 남겨 봅니다.. 실례가 되지 않으신다면 답 달아 주신다면 정말 감사드리겠습니다 ??더운 여름 잘 보내시길 바랍니다 ??,안녕하세요 조교 님 : ) 여름 잘 보내 시 고 계시 ㄴ가요 ?? 이렇게 게시판 에 글 달 어 주 시 고 도움 주 시 어서 항상 정말 너무 감사 드리 ㅂ니다 . 다르 ㅁ 이 아니 라 제 가 지금 도저히 부전공 A 가 너무 맞 지 않 어 부전공 B 바꾸 려고 하 ㅂ니다 . 1 ) 이 경우 에 도 5월 / 11월 로 알 고 있 는 이중 ( ? ) 부전공 변경 신청 때 변경 가능 하 ㄴ 거 이 ㄴ가요 ? 2 ) 이 경우 도 ( 부전공 에서 부전공 으로 바뀌 지만 ) 바꾸 려는 부전공 에 따르 어 학점 이나 티 오 등 의 제한 이 있 나요 ? ( 이중 변경 시 제한 이 있 어 여쭙 니다 ! ) 3 ) 부전공 B 로 변경 후 나중 에 이 B 를 후기 이중이 나 기회 를 통하 어 이중 전공 으로 올리 ㄹ 기회 가 주어지 ㄹ까요 ? ㅠ ( 부전공 A > 부전공 B 변경 시 부전공 B 로 고정 이 ㄹ까요 ? ㅠ ) 4 ) 바꾸 ㄹ 부전공 B 의 학점 을 미리 인정 받 을 방법 이 있 을까요 ? 너무 많 은 질문 을 드리 ㄴ 것 같 어 죄송 하 ㅂ니다 . 주변 에서 는 부전공 이 ㄴ데 왜 이렇 게 연연 하 냐 그냥 듣 고 잘 졸업 하 라 등 의 말 이 많 은데 저 에게 너무 맞 지 않 어 고민 에 고민 끝 네 이렇 게 글 남기 어 보 ㅂ니다 .. 실례 가 되 지 않 으시 ㄴ다면 답 달 어 주 시 ㄴ다면 정말 감사 드리 겠 습니다 ?? 덥 은 여름 잘 보내 시 기 ㄹ 바라 ㅂ니다 ??,,
1643,이중전공,"조교님 안녕하세요, 저는 7학기를 앞두고 있는 14학번 입니다. 저는 현재 전공 54 교양 26을 채워 놓은 상태입니다.이중전공 들었던 과목들은 변경되어서 자선으로 넘어간 상태이구요.즉, 이중전공을 제외한 이수학점은 다 채워놓았습니다다음학기 부터 새로 듣게될 부전공을 후기 이중으로 올릴 계획을 앞두고 있습니다. 그래서 다음학기 부터는 부전공과목(추후에 후기이중이될 과목)만 들을 계획인데요,  제가 20년 4월, 그러니까 제가 후기이중을 신청할 시기에 저는 이번 19-2 부전공 18, 그리고 내년 20-1에 18을 들어 놓을 계획이 있습니다.   여쭈어 보고 싶은것은, 후기 이중을 신청할 시기에 ""졸업에 맞는 전체학점 이수""를 해야 한다고 했는데,그 학점이 전공54 부전공21 교양 26이 맞는지요? , ""자선""은 따로 들을 필요가 없는게 맞겠지요?그래서 제가 신청할때 저는 아마 전공54 부전공36 교양 26이 될텐데 이게 자격에 해당하는지요?감사합니다.","조교 님 안녕하세요 , 저 는 7 학기 를 앞두 고 있 는 14 학번 이 ㅂ니다 . 저 는 현재 전공 54 교양 26 을 채우 어 놓 은 상태 이 ㅂ니다 . 이중전공 들 었 던 과목 들 은 변경 되 어서 자선 으로 넘어가 ㄴ 상태 이 구요 . 즉 , 이중전공 을 제외 하 ㄴ 이수 학점 은 다 채우 어 놓 었 습니다 다음 학기 부터 새로 듣 게 되 ㄹ 부전공 을 후기 이중 으로 올리 ㄹ 계획 을 앞두 고 있 습니다 . 그래서 다음 학기 부터 는 부전공 과목 ( 추후 에 후기이중 이 되 ㄹ 과목 ) 만 듣 을 계획 이 ㄴ데요 , 제가 20년 4월 , 그러니까 제가 후기이중 을 신청 하 ㄹ 시기 에 저 는 이번 19 - 2 부전공 18 , 그리고 내년 20 - 1 에 18 을 들 어 놓 을 계획 이 있 습니다 . 여쭈 어 보 고 싶 은 것 은 , 후기 이중 을 신청 하 ㄹ 시기 에 "" 졸업 에 맞 는 전체 학점 이 수 "" 를 하 어야 하 ㄴ다고 하 었 는데 , 그 학점 이 전공 54 부전공 21 교양 26 이 맞 는지 이 오 ? , "" 자선 "" 은 따로 듣 을 필요 가 없 는 것 이 맞 겠 지요 ? 그래서 제 가 신청 하 ㄹ 때 저 는 아마 전공 54 부전공 36 교양 26 이 되 ㄹ 터 이 ㄴ데 이 게 자격 에 해당 하 는지 이 오 ? 감사 하 ㅂ니다 .",,
1644,이중전공,"안녕하세요 조교님익씨를 이중전공하는 학생입니다. 영어대교류 과목을 수강하려고 하는데, 영어대타학과 수강신청함 비고란에영어대교류(이중)이라고 되어 있는 과목을 선택할 수 있는건가요?","안녕하세요 조교님익 씨 를 이중전공 하 는 학생 이 ㅂ니다 . 영어 대 교류 과목 을 수강 하 려고 하 는데 , 영어 대타 학과 수강 신청 함 비고 란 에 영어 대 교류 ( 이중 ) 이라고 되 어 있 는 과목 을 선택 하 ㄹ 수 있 는 거 이 ㄴ가요 ?",,
1645,이중전공,조교님 안녕하세요! 수강인정 관련 질문드리려 합니다.본전공에서 ㅁㄴㅇㄹ 과목이 열리고 이중전공에서도 ㅁㄴㅇㄹ 라는 이름이 같은 과목이 개설됩니다.1) 하나만 들어도 두 전공에서 학점 인정이 되는것인지 택 1형식인지2) 이름 같은 과목을 동시에 수강해도 되는지질문드립니다.수강편람에는 동일학과라 가정하고 적혀있길래 질문드려요. 감사합니다!,조교 님 안녕하세요 ! 수강 인정 관련 질문 드리 려 하 ㅂ니다 . 본 전공 에서 ㅁㄴㅇㄹ 과목 이 열리 고 이중전공 에서 도 ㅁㄴㅇㄹ 이 라는 이름 이 같 은 과목 이 개설 되 ㅂ니다 . 1 ) 하나 만 듣 어도 두 전공 에서 학점 인정 이 되 는 것 이 ㄴ지 택 1 형식 이 ㄴ 지 2 ) 이름 같 은 과목 을 동시 에 수강 하 어도 되 는지 질문 드리 ㅂ니다 . 수강편람 에 는 동일 학과 이 라 가정 하 고 적히 어 있 길래 질문 드리 어요 . 감사 하 ㅂ니다 !,,
1646,부전공,"조교님!  감사합니다! 정외, 행정, 언론정보, 광고 등등부전공으로 신청하면 설캠 수업 못 듣잖아요근데 제가 후기이중을 하려 하는데, 4-1에 글캠에서 들을수 있는 수업을 다 들으면 어떻게 되는 건가요? 후기이중전까지(4-2까지) 계속 부전공 신분 일텐데요 ㅠ","조교 님 ! 감사 하 ㅂ니다 ! 정 외 , 행정 , 언론 정보 , 광고 등등 부전공 으로 신청 하 면 설 캠 수업 못 듣 잖아요 근데 제 가 후기이중 을 하 려 하 는데 , 4 - 1 에 글캠 에서 듣 을 수 있 는 수업 을 다 듣 으면 어떻 게 되 는 거 이 ㄴ가요 ? 후기 이중 전 까지 ( 4 - 2 까지 ) 계속 부전공 신분 이 ㄹ 터 이 ㄴ데요 ㅠ",,
1647,부전공,안녕하세요경영학 부전공학생입니다.부전공시 21학점만 이수해도 되는데경영학부 수업 3학점 경영학전공 수업을 18학점들었는데경영학부 수업이 자선으로 내려가 있더라구요ㅜㅜㅠ학종지가면 되나요?,안녕하세요 경영학 부전공 학생 이 ㅂ니다 . 부전공 시 21 학점 만 이수 하 어도 되 는데 경영 학부 수업 3 학점 경영학 전공 수업 을 18 학점 듣 었 는데 경영 학부 수업 이 자선 으로 내려가 어 있 더라구요 ㅜㅜㅠ 학 종지 가 면 되 나요 ?,,
