ID,CLASS,QUESTION,LEMMA,ANSWER,TAGSET
630,이중전공,조교님 안녕하세요저는 1학년 1학기까지 다니고 휴학을 했습니다이번 2020-1학기에 복학하고자 하는데요!1) 1학기를 마치고 이중전공 신청기간이 있는지요?2) 2020-1학기를 마치고 이중전공을 신청하지 아니하고 2020-2학기를 마치고 이중전공을 신청하면 2학년 1학기인데 그때도 이중전공을 신청 가능한지요?3) 2)와 같이 신청하게 되면 3학기의 평점 평균으로 이중전공을 신청하게 되는 것인가요?감사합니다^^,조교 님 안녕하세요 저 는 1 학년 1 학기 까지 다니 고 휴학 을 하 었 습니다 이번 2020 - 1 학기 에 복학 하 고자 하 는데요 ! 1 ) 1 학기 를 마치 고 이중전공 신청 기간 이 있 는지요 ? 2 ) 2020 - 1 학기 를 마치 고 이중전공 을 신청 하 지 아니하 고 2020 - 2 학기 를 마치 고 이중전공 을 신청 하 면 2 학년 1 학기 이 ㄴ데 그때 도 이중전공 을 신청 가능 하 ㄴ 지요 ? 3 ) 2 ) 와 같이 신청 하 게 되 면 3 학기 의 평점 평균 으로 이중전공 을 신청 하 게 되 는 것 이 ㄴ가요 ? 감사 하 ㅂ니다 ^^,,
631,융합전공,융합전공 관련 질문입니다!융합전공은 2학년 이전에만 선택 가능하다는 것을 봤는데2-2학기 때 이중변경으로 융합전공을 선택해도 되나요?,융합전공 관련 질문 이 ㅂ니다 ! 융합전공 은 2 학년 이전 에 만 선택 가능 하 다는 것 을 보 었 는데 2 - 2 학기 때 이중 변경 으로 융합전공 을 선택 하 어도 되 나요 ?,,
632,이중전공,조교님 안녕하세요 현재 소수어과 플렉스 통과에 이중전공 토익안내고 학종에도 토익 제출을 안한상태입니다.학종지에 토익 제출해도 이중전공에 토익을 제출 안한 상태니 졸업유예가 되는건가요?이중전공은 우편으로도 토익 받아주는데 학종지는 직접 제출해야하는것같아서 번거로워서 아예 미리 제출해놓을까합니다. 졸업유예원하고요,조교 님 안녕하세요 현재 소수어 과 플 렉스 통과 에 이중전공 토익 안 내 고 학종 에 도 토익 제출 을 안 하 ㄴ 상태 이 ㅂ니다 . 학 종지 에 토익 제출 하 어도 이중전공 에 토익 을 제출 안 하 ㄴ 상태 이 니 졸업 유예 가 되 는 거 이 ㄴ가요 ? 이중 전공 은 우편 으로 도 토익 받 어 주 는데 학종지 는 직접 제출 하 어야 하 는 것 같 어서 번거롭 어서 아예 미리 제출 하 어 놓 을까 하 ㅂ니다 . 졸업 유예 원하 고요,,
633,이중전공,"안녕하세요 조교님!저는 지금 어문계열을 전공중인 1학년입니다.근데 제가 다른 언어에 너무 흥미가 생기고 빠져버려서 고민 끝에 이중전공 1지망으로 경제를 쓰고 2지망으로는 그 언어를 썼습니다.  근데 만약 경제가 떨어지고 제가 원하는 언어 학과를 이중전공으로 하게 되면, 언어 두개는 아무래도 아닌거같아서 그냥 그 언어 학과로 전과하고자 합니다. 제가 만약 전과에 성공한다고 가정했을때 이중전공 1지망으로 선택한 경제에 붙으면 다행이지만 만약 경제학과에 떨어져서 2지망으로 선택한 똑같은 그 언어학과가 되어버리면 어떻게 되나요? 그럼 다시 이중전공을 신청할 수있나요? ","안녕하세요 조교 님 ! 저 는 지금 어문 계열 을 전공 중 이 ㄴ 1 학년 이 ㅂ니다 . 근데 제 가 다른 언어 에 너무 흥미 가 생기 고 빠지 어 버리 어서 고민 끝 에 이중전공 1 지망 으로 경제 를 쓰 고 2 지망 으로 는 그 언어 를 쓰 었 습니다 . 근데 만약 경제 가 떨어지 고 제 가 원하 는 언어 학과 를 이중전공 으로 하 게 되 면 , 언어 두 개 는 아무래도 아니 ㄴ 거 같 어서 그냥 그 언어 학과 로 전과 하 고자 하 ㅂ니다 . 제가 만약 전과 에 성공 하 ㄴ다고 가정 하 었 을 때 이중전공 1 지망 으로 선택 하 ㄴ 경제 에 붙 으면 다행 이 지만 만약 경제학 과 에 떨어지 어서 2 지망 으로 선택 하 ㄴ 똑같 은 그 언어학 과 가 되 어 버리 면 어떻 게 되 나요 ? 그럼 다시 이중전공 을 신청 하 ㄹ 수 있 나요 ?",,
634,부전공,안녕하세요 조교님.현재 4학년 1학기까지 마친 상태입니다.현재 부전공 과정중에1전공 47  부전공 20학점을 들었습니다. 다음학기 들으면 다 채워질 예정입니다.다름이아니라 제가 교양 재수강이 하나 남았는데 다음학기(1학기)에 4학년 2학기를 수료한 후 여름 계절학기와 2학기를 추가학기로 다닐수 있는지  궁금합니다.추가학기를 위해 졸업 요건인 졸업논문 1 2 중 1만 수강한 상태이고 추가학기 때 2를 들으려고 합니다.그런데 졸업논문이 졸업 요건이긴하지만 전필로는 설정이 안되어 있어서 추가학기가 가능한지 궁금합니다.만약 추가학기가 불가능하다면 부전공을 전공,안녕하세요 조교 님 . 현재 4 학년 1 학기 까지 마치 ㄴ 상태 이 ㅂ니다 . 현재 부전공 과정 중 에 1 전공 47 부전공 20 학점 을 듣 었 습니다 . 다음 학기 듣 으면 다 채우 어 지 ㄹ 예정 이 ㅂ니다 . 다르 ㅁ 이 아니 라 제가 교양 재수강 이 하나 남 었 는데 다음 학기 ( 1 학기 ) 에 4 학년 2 학기 를 수료 하 ㄴ 후 여름 계절 학기 와 2 학기 를 추가 학기 로 다니 ㄹ 수 있 는지 궁금 하 ㅂ니다 . 추가 학기 를 위하 어 졸업 요건 이 ㄴ 졸업 논문 1 2 중 1 만 수강 하 ㄴ 상태 이 고 추가 학기 때 2 를 듣 으려고 하 ㅂ니다 . 그런데 졸업 논문 이 졸업 요건 이 기 ㄴ 하 지만 전필로 는 설정 이 안 되 어 있 어서 추가 학기 가 가능 하 ㄴ지 궁금 하 ㅂ니다 . 만약 추가 학기 가 불 가능 하 다면 부전공 을 전공,,
635,이중전공,안녕하세요 조교님!제가 1학기에 17학점을 들었고 지금은 18학점을 듣고있는데 1학기에 들었던 2학점 교양을 18학점안에 재수강 과목으로 듣고있습니다! 이렇게 되면 학기말에 이수학점이 33학점으로 인정되는건가요 35학점으로 인정되는건가요?? 이중전공때문에 불안해서 이렇게 질문드립니다ㅠㅠ,안녕하세요 조교 님 ! 제 가 1 학기 에 17 학점 을 듣 었 고 지금 은 18 학점 을 듣 고 있 는데 1 학기 에 들 었 던 2 학점 교양 을 18 학점 안 에 재수강 과목 으로 듣 고 있 습니다 ! 이렇 게 되 면 학기 말 에 이수 학점 이 33 학점 으로 인정 되 는 거 이 ㄴ가요 35 학점 으로 인정 되 는 거 이 ㄴ가요 ?? 이중전공 때문 에 불안 하 어서 이렇게 질문 드리 ㅂ니다 ㅠㅠ,,
636,이중전공,조교님 졸업유예생인데 토익은 본전공 과사무실에 내야하나요? 영통 이중전공이라 영통에도 내야하는데  영통에만 내도되나요?,조교 님 졸업 유예 생 이 ㄴ데 토익 은 본 전공 과 사무실 에 내 어야 하 나요 ? 영통 이중전공 이 라 영통 에 도 내 어야 하 는데 영통 에 만 내 어도 되 나요 ?,,
637,이중전공,안녕하세요 조교님:)BRICs 이중전공으로 신청하고 싶습니다저는 18학번이지만 한학기 휴학을 해서 2-1학기 재학 중입니다이미 다른 이중전공을 하고 있는데 브릭스로 이중변경을 하고자합니다수강편람에 보니까 1학년 2학기 소정기간 동안 신청할 수 있다고 쓰여있는데 그 이후 학기에는 이중 신청이나 변경이 불가능 한건가요?,안녕하세요 조교 님 : ) BRICs 이중전공 으로 신청 하 고 싶 습니다 저 는 18 학번 이 지만 한 학기 휴학 을 하 어서 2 - 1 학기 재학 중 이 ㅂ니다 이미 다른 이중전공 을 하 고 있 는데 브릭스 로 이중 변경 을 하 고자 하 ㅂ니다 수강 편 이 라 ㅁ 에 보 니까 1 학년 2 학기 소정 기간 동안 신청 하 ㄹ 수 있 다고 쓰이 어 있 는데 그 이후 학기 에 는 이중 신청 이나 변경 이 불 가능 하 ㄴ 거 이 ㄴ가요 ?,,
638,이중전공,조교님! 요번 이중전공 신청 관련해서 여쭤볼게있는데요경쟁률은 서울 글로벌캠퍼스 합쳐서 낸 결과인가요??예를 들어 지경개는 캠퍼스 별로 20명씩 뽑는데 일단 종정시 상에서는 신청할때 합쳐서 표시된건가요??,조교 님 ! 요번 이중전공 신청 관련 하 어서 여쭈 어 보 ㄹ게 있 는데요 경쟁 률 은 서울 글로벌 캠퍼스 합치 어서 내 ㄴ 결과 이 ㄴ가요 ?? 예 를 들 어 지경개 는 캠퍼스 별 로 20 명 씩 뽑 는 데 일단 종정 시 상 에서 는 신청 하 ㄹ 때 합치 어서 표시 되 ㄴ 거 이 ㄴ가요 ??,,
639,이중전공,조교님 안녕하세요!!국리가 부전공이 되는 걸로 알구 있는데 올해도 마찬가지인가요??이중전공 설명에 아무리 봐도 외국어로서의 한국어 교육은 부전 가능한데 국리 부전 가능이란 말이 없더라구오ㅠㅠ,조교 님 안녕하세요 !! 국리 가 부전공 이 되 는 거 ㄹ로 알 구 있 는데 올해 도 마찬가지 이 ㄴ가요 ?? 이중전공 설명 에 아무리 보 어도 외국어 로서 의 한국어 교육 은 부전 가능 하 ㄴ데 국 리 부전 가능 이 란 말 이 없 더라구 오 ㅠㅠ,,
640,이중전공,안녕하세요 조교님!저는 이중전공으로 글로벌캠퍼스 영어통번역학부의영어통번역학과를 이수하고 있습니다.이번 계절학기에 서울캠퍼스에서 수업을들으려고 하는데 서울캠퍼스에서 들을 수 있는영어관련학과 수업 중 어떤 과목들이영어통번역학과의 이수학점으로 인정이 되는지알고 싶습니다! 비고란에 '영어통번역학과만 전필'이라고적혀있는 과목들은 계절학기에 수강할 경우제 이수학점 중 영어통번역학과 필수 이수학점으로포함되는 건가요???,안녕하세요 조교 님 ! 저 는 이중전공 으로 글로벌 캠퍼스 영어 통 번역 학부 의 영어 통 번역 학과 를 이수 하 고 있 습니다 . 이번 계절 학기 에 서울 캠퍼스 에서 수업 을 듣 으려고 하 는데 서울 캠퍼스 에서 듣 을 수 있 는 영어 관련 학과 수업 중 어떤 과목 들 이 영어 통 번역 학과 의 이수 학점 으로 인정 이 되 는지 알 고 싶 습니다 ! 비고 란 에 ' 영어 통 번역 학과 만 전 필 ' 이라고 적히 어 있 는 과목 들 은 계절 학기 에 수강 하 ㄹ 경우 저 의 이수 학점 중 영어통 번역학 과 필수 이수 학점 으로 포함 되 는 거 이 ㄴ가요 ???,,
641,이중전공,조교님!현재 6학기 이수 중인 편입생입니다.현재 이중전공 생각하고 있는 과 강의를 자선으로 듣고 있는 중입니다.이중신청하려고 보니 5학기 미만 성적 취득 한 자만 가능하다며 막혀있어서 학종지에 연락해보니 이중변경신청 때 신청하라고 하시더라구요.그러면 내년 이중변경 신청 때 해야되는 건데그때 이중전공신청이 정말 가능한 가에 대해서 의문이 생겨 문의드립니다....내년에 하게 되면 작년 편입생이 되는 건데 또 안되는 거 아닌 가 해서요현재 학종지 이중전공 담당자분께서 많이 바쁘셔서 통화를 짧게짧게만 하려고 하셔서 더 불안하네요ㅠㅠ,조교 님 ! 현재 6 학기 이수 중 이 ㄴ 편입 생 이 ㅂ니다 . 현재 이중전공 생각 하 고 있 는 과 강의 를 자선 으로 듣 고 있 는 중 이 ㅂ니다 . 이 중 신청 하 려고 보니 5 학기 미만 성적 취득 하 ㄴ 자 만 가능 하 다며 막히 어 있 어서 학종지 에 연락 하 어 보 니 이 중 변경 신청 때 신청 하 라고 하 시 더라구요 . 그러면 내년 이중 변경 신청 때 하 어야 되 는 거 이 ㄴ데 그때 이중전공 신청 이 정말 가능 하 ㄴ 가 에 대하 어서 의문 이 생기 어 문의 드리 ㅂ니다 .... 내년 에 하 게 되 면 작년 편입 생 이 되 는 거 이 ㄴ데 또 안 되 는 거 아니 ㄴ 가하 어서요 현재 학 종지 이중전공 담당자 분 께서 많이 바쁘 시 어서 통화 를 짧 게 짧 게 만 하 려고 하 시 어서 더 불안 하 네요 ㅠㅠ,,
642,부전공,조교님! 이중 전공 말고 전공심화+부전공은 신청기간이 아닌가요??,조교 님 ! 이중 전공 말 고 전공심화 + 부전공 은 신청 기간 이 아니 ㄴ가요 ??,,
643,이중전공,"안녕하세요 조교님 의욕이 넘치는 19학번입니다.다름이 아니라 요즘들어 자꾸 ‘이중전공’이 아니라 ‘삼중전공’을 하고 싶다는 생각이 듭니다.본전공은 언어인데, 현재 이중전공은 경제를 신청해 놓은 상태입니다.그런데 자꾸 지경개나 정외같은 전공이 자꾸 끌리고 재밌어 보입니다...만약 계절학기 등을 통해 학점을 꽉꽉 채워넣는다면, 언어+경제 외에 한 전공을 더 이수해서 학사를 받을 수 있는 방안을 학교에서 열어주나요??궁금합니다","안녕하세요 조교 님 의욕 이 넘치 는 19 학번 이 ㅂ니다 . 다르 ㅁ 이 아니 라 요즘 들 어 자꾸 ‘ 이중전공 ’ 이 아니 라 ‘ 삼중 전공 ’ 을 하 고 싶 다는 생각 이 들 ㅂ니다 . 본 전공 은 언어 이 ㄴ데 , 현재 이중전공 은 경제 를 신청 하 어 놓 은 상태 이 ㅂ니다 . 그런데 자꾸 지경 개 나 정외 같 은 전공 이 자꾸 끌리 고 재밌 어 보이 ㅂ니다 ... 만약 계절 학기 등 을 통하 어 학점 을 꽉 꽉 채우 어 넣 는다면 , 언어 + 경제 외 에 한 전공 을 더 이수 하 어서 학사 를 받 을 수 있 는 방안 을 학교 에서 열 어 주 나요 ?? 궁금 하 ㅂ니다",,
644,이중전공,조교님 안녕하세요!오늘까지 이중전공 신청이라 고민이 되어서 이렇게 글을 남깁니다. 저는 현재 어문계열 전공인데 이중을 정치외교로 신청할 생각입니다. 그런데 2학기 성적이 괜찮다면 다른 과로 전과할 생각도 있습니다. 이 경우에 전과와 이중전공이 둘다 된다면 둘중 하나만 선택하는건가요?아니면 둘다 되는건가요? 감사합니다 조교님!,조교 님 안녕 하 시 어요 ! 오늘 까지 이중전공 신청 이 라 고민 이 되 어서 이렇 게 글 을 남기 ㅂ니다 . 저 는 현재 어문 계열 전공 이 ㄴ데 이 중 을 정치 외교 로 신청 하 ㄹ 생각 이 ㅂ니다 . 그런데 2 학기 성적 이 괜찮 다면 다른 과 로 전과 하 ㄹ 생각 도 있 습니다 . 이 경우 에 전과 와 이중전공 이 둘 다 되 ㄴ다면 둘 중 하나 만 선택 하 는 거 이 ㄴ가요 ? 아니 면 둘 다 되 는 거 이 ㄴ가요 ? 감사 하 ㅂ니다 조교 님 !,,
645,이중전공,조교님 안녕하세요! 이중 전공과 전과로 문의드릴 것이 있어서 글을 올립니다.이번에 이중 전공으로 1지망 국통 2지망 LT를 신청하게 되었는데 이번 학기 성적이 잘나온다면 국통으로 전과를 하고싶습니다. 만약 전과를 하게 될 경우 기존 신청했던 1지망 이중전공이 본전공이 되게 되는데 이 경우 2지망이 이중전공으로 배치 되나요? (참고로 19학번입니다),조교 님 안녕하세요 ! 이중 전공 과 전과 로 문의 드리 ㄹ 것 이 있 어서 글 을 올리 ㅂ니다 . 이번 에 이중 전공 으로 1 지망 국 통 2 지망 LT 를 신청 하 게 되 었 는데 이번 학기 성적 이 잘 나오 ㄴ다면 국 통 으로 전과 를 하 고 싶 습니다 . 만약 전과 를 하 게 되 ㄹ 경우 기존 신청 하 었 던 1 지망 이중전공 이 본전 공 이 되 게 되 는데 이 경우 2 지망 이 이중전공 으로 배치 되 나요 ? ( 참고 로 19 학번 이 ㅂ니다 ),,
646,이중전공,안녕하세요!!내일이면 어느덧 이중전공 신청 마감일인데요. 하고 싶은 과가 두 개여서 혹시 이중전공과 더불어 부전공도 들을 수 있는지 여쭤보고 싶습니다. 불가능할 것 같다 예상하지만 혹시나 하는 마음에 물어봅니다. 감사합니다:),안녕하세요 !! 내일 이 면 어느 덧 이중전공 신청 마감일 이 ㄴ데요 . 하 고 싶 은 과 가 두 개 이 어서 혹시 이중전공 과 더불 어 부전공 도 듣 을 수 있 는지 여쭈 어 보 고 싶 습니다 . 불 가능 하 ㄹ 것 같 다 예상 하 지만 혹시나 하 는 마음 에 묻 어 보 ㅂ니다 . 감사 하 ㅂ니다 : ),,
647,이중전공,조교님 안녕하세요:)한 과목을 재수강신청해서 이전성적을 없앨 계획인데 이중전공 학점컷에 재수강한 성적 말고 이전성적이 들어가는건가요??감사합니다??,조교 님 안녕하세요 : ) 한 과목 을 재 수강 신청 하 어서 이전 성적 을 없애 ㄹ 계획 이 ㄴ 데 이중전공 학점 컷 에 재수강 하 ㄴ 성 적 말 고 이전 성적 이 들어가 는 거 이 ㄴ가요 ?? 감사 하 ㅂ니다 ??,,
648,이중전공,"조교님 ㅠㅠ 고생이 많으십니다!저는 지금 당장 하고싶은게 없어서 이중을 못정한 상태입니다. 그래서 당장은 이중전공을 선택하고싶지 않습니다ㅠㅠ1. 지금 아무거나 선택하고 아무 수업도 듣지않다가 고학년 때 이중 변경신청이 가능한가요?2. 지금 신청 안하고 3,4학년 때 이중전공 신청이 가능한가요? 아니면 그때는 신청변경만 가능한건 가요??","조교 님 ㅠㅠ 고생 이 많 으시 ㅂ니다 ! 저 는 지금 당장 하 고 싶 은 것 이 없어 서 이중 을 못 정하 ㄴ 상태 이 ㅂ니다 . 그래서 당장 은 이중전공 을 선택 하 고 싶 지 않 습니다 ㅠㅠ 1 . 지금 아무거 나 선택 하 고 아무 수업 도 듣 지 않 다가 고 학년 때 이중 변경 신청 이 가능 하 ㄴ가요 ? 2 . 지금 신청 안 하 고 3 , 4 학년 때 이중전공 신청 이 가능 하 ㄴ가요 ? 아니 면 그 때 는 신청 변경 만 가능 하 ㄴ 거 ㄴ 가 어요 ??",,
649,이중전공,"안녕하세요 조교님저는 영어통번역학부 14학번인데요, 수강편람을 보다가 궁금한 점이 생겨서 질문 드립니다졸업 요건을위해서 4가지 트랙이 있는 것으로 알고 있는데,  이중전공을 제외하면전공 (70) + 부전공 (21)전공심화 (83) + 부전공(21)전공심화(83)이렇게 있는 것으로 알고있습니다. 제가 궁금한 점은 전공+부전공과 전공심화+부전공 간의 차이인데요,혹시 영어통번역학부 학생도 전공심화+부전공이 아니라 전공+부전공트랙을 선택해도 되는 것인가요?근데 만약 그게 가능하다면, 대체 두 트랙 간의 차이가 무엇인지 알 수가 없기에 이렇게 질문을 드립니다.","안녕하세요 조교 님 저 는 영어 통 번역 학부 14 학번 이 ㄴ데요 , 수강편람 을 보 다가 궁금 하 ㄴ 점 이 생기 어서 질문 드리 ㅂ니다 졸업 요건 을 위하 어서 4 가지 트랙 이 있 는 것 으로 알 고 있 는데 , 이중전공 을 제외 하 면 전공 ( 70 ) + 부전공 ( 21 ) 전공심화 ( 83 ) + 부전공 ( 21 ) 전공심화 ( 83 ) 이렇 게 있 는 것 으로 알 고 있 습니다 . 제 가 궁금 하 ㄴ 점 은 전공 + 부전공 과 전공심화 + 부전공 간 의 차이 이 ㄴ데요 , 혹시 영어 통 번역 학부 학생 도 전공심화 + 부전공 이 아니 라 전공 + 부전공 트랙 을 선택 하 어도 되 는 것 이 ㄴ가요 ? 근데 만약 그 게 가능 하 다면 , 대체 두 트랙 간 의 차이 가 무엇 이 ㄴ지 알 ㄹ 수 가 없 기에 이렇 게 질문 을 드리 ㅂ니다 .",,
650,이중전공,"조교님!제가 지비티 이중전공을 안했는 데 지금 현재 자선으로 지비티 수업을 3개를 듣고 있습니다!그런데 경제 쪽이나 다른 경상계열로 이중전공을 해야 되나 싶어서 고민 중에 있는데 들었던 수업이 계속 자선으로 되나 싶어서요.....들은 수업은 회계원리, 인적자원관리, 조직행위론 입니다","조교 님 ! 제 가 지 비 티 이중전공 을 안 하 었 는 데 지금 현재 자선 으로 지 비 티 수업 을 3 개 를 듣 고 있 습니다 ! 그런데 경제 쪽 이나 다른 경상 계열 로 이중전공 을 하 어야 되 나 싶 어서 고민 중 에 있 는 데 들 었 던 수업 이 계속 자선 으로 되 나 싶 어서요 ..... 들 은 수업 은 회계 원리 , 인적자원관리 , 조직 행위론 이 ㅂ니다",,
651,이중전공,안녕하세요 이중전공 우선 배정자 관련하여 질문 드립니다!학생 1 (34학점 이상 이수) 1지망 A전공 2지망 B전공학생 2 (34학점 미만 이수) 1지망 B전공이 경우 학생1이 1지망 전공을 이수하지 못하게 되었을 경우 B전공에 대해 학생1과 학생2중 누가 우선적으로 배정되나요??,안녕하세요 이중전공 우선 배정자 관련 하 어 질문 드리 ㅂ니다 ! 학생 1 ( 34 학점 이상 이수 ) 1 지망 A 전공 2 지망 B 전공 학생 2 ( 34 학점 미만 이수 ) 1 지망 B 전공 이 경우 학생 1 이 1 지망 전공 을 이수 하 지 못하 게 되 었 을 경우 B 전공 에 대하 어 학생 1 과 학생 2 중 누가 우선 적 으로 배정 되 나요 ??,,
652,이중전공,"안녕하세요 조교님! 항상 고생이 많으십니다궁금한게 있는데, 1. 4-2 졸업이수학점을 다 채운 상태면, 계절로 재수강을 할 수 없나요?2. 제가 이중전공을 부전공으로 내릴 계획인데, 지금까지 들어놓은 자전 학점이 부전공으로 내리면 자연스럽게 연결되나요?3. 이중이 프랑스어학부인데, 이를 부전공으로 내리면 신청해놓은 세부전공은 없어지는건가요?","안녕하세요 조교 님 ! 항상 고생 이 많 으시 ㅂ니다 궁금 하 ㄴ 게 있 는데 , 1 . 4 - 2 졸업 이수 학점 을 다 채우 ㄴ 상태 이 면 , 계절 로 재수강 을 하 ㄹ 수 없 나요 ? 2 . 제가 이중전공 을 부전공 으로 내리 ㄹ 계획 이 ㄴ데 , 지금 까지 들 어 놓 은 자전 학점 이 부전공 으로 내리 면 자연 스럽 게 연결 되 나요 ? 3 . 이중이 프랑스 어 학부 이 ㄴ데 , 이 를 부전공 으로 내리 면 신청 하 어 놓 은 세부 전공 은 없 어 지 는 거 이 ㄴ가요 ?",,
653,부전공,안녕하세요 조교님 ^^ 다름이 아니라 제가 이번에 부전공 변경을 할 계획인데 제가 아는 바로는 변경 후 이전에 들은 학점이 자선 처리가 되는 것으로 알고 있습니다.1. 그렇다면 이전에 들었던 학점은 교양으로 재수강을 해야하나요?(가능한가요?)2. 그렇지 않다면 이전 부전공으로 재수강해야 하는데 부전공이 바뀐 상태에서 재수강을 허용해주나요?학종지에도 전화에 봤는데 제대로 답을 못 주셔서 여기에 질문 드립니다ㅠ 감사합니다.,안녕하세요 조교 님 ^^ 다르 ㅁ 이 아니 라 제 가 이번 에 부전공 변경 을 하 ㄹ 계획 이 ㄴ데 제 가 알 는 바 로 는 변경 후 이전 에 듣 은 학점 이 자선 처리 가 되 는 것 으로 알 고 있 습니다 . 1 . 그렇 다면 이 전 에 듣 었 던 학점 은 교양 으로 재수강 을 하 어야 하 나요 ? ( 가능 하 ㄴ가요 ? ) 2 . 그렇 지 않 다면 이전 부전공 으로 재 수강 하 어야 하 는 데 부전공 이 바뀌 ㄴ 상태 에서 재수강 을 허용 하 어 주 나요 ? 학종지 에 도 전화 에 보 었 는데 제대로 답 을 못 주 시 어서 여기 에 질문 드리 ㅂ니다 ㅠ 감사 하 ㅂ니다 .,,
654,이중전공,안녕하세요 조교님 :)이번에 졸업예정인 학생입니다.제학번기준 졸업이수학점이 전공54 이중전공42 교양32 +자선6 인데요. 제가 교양을 33학점들어서 최소이수학점에서 1학점 초과되는 부분이있는데 이게 졸업요건을 맞추기 위한 자선학점으로 넘어갈수있는건가요?만약 넘어간다면 추가로 들은 강의가 꼭 1학점짜리 강의를 들어야 넘어가는건지 아니면 2학점짜리를 들어도 1학점만 넘어갈수있는건지 알고싶습니다,안녕하세요 조교 님 : ) 이번 에 졸업 예정 이 ㄴ 학생 이 ㅂ니다 . 저 의 학번 기준 졸업 이수 학점 이 전공 54 이중전공 42 교양 32 + 자선 6 이 ㄴ데요 . 제가 교양 을 33 학점 듣 어서 최소 이수 학점 에서 1 학점 초과 되 는 부분 이 있 는데 이 게 졸업 요건 을 맞추 기 위하 ㄴ 자선 학점 으로 넘어가 ㄹ 수 있 는 거 이 ㄴ가요 ? 만약 넘어가 ㄴ다면 추가 로 들 은 강의 가 꼭 1 학점 짜리 강의 를 듣 어야 넘어가 는 거 이 ㄴ지 아니 면 2 학점 짜리 를 듣 어도 1 학점 만 넘어가 ㄹ 수 있 는 거 이 ㄴ지 알 고 싶 습니다,,
655,부전공,조교님 안녕하세요! 저는 현재 자대생인데요. 제가 지금 자선으로 일반 생물학을 수강했습니다. 만약 전심+부전공으로 생명공학과를 신청하게 되면 이번 년도에 수강한 일생 과목은 부전공 전공 학점으로 넘어가게 되는 건가요?,조교 님 안녕하세요 ! 저 는 현재 자대생 이 ㄴ데요 . 제 가 지금 자선 으로 일반 생물학 을 수강 하 었 습니다 . 만약 전심 + 부전공 으로 생명 공학 과 를 신청 하 게 되 면 이번 년도 에 수강 하 ㄴ 일생 과목 은 부전공 전공 학점 으로 넘어가 게 되 는 거 이 ㄴ가요 ?,,
