ID,CLASS,QUESTION,LEMMA,ANSWER,TAGSET
1138,이중전공,"안녕하세요, 이번에 영통 이중전공 신청한 17입니다.학부이므로 세부 학과까지 1지망부터 4지망까지 모두 선택해서 낸 상황인데, 갑자기 1지망과 2지망을 바꾸고 싶어졌어요..8ㅅ8...혹시 지금 혹은 결과 나온 후에라도 바꿀 수 있는지 여쭤보고 싶습니다.이중전공을 1회 바꿀 수 있는 걸 아는데, 인원제한이 없는 영어통번역학부 심지어 그 내부의 학과 바꾸는 데에 그 1회를 사용해야 하는지요? 그렇게 하지 않고 그냥 바꿀 수 있는 방법은 없나요?","안녕하세요 , 이번 에 영통 이중전공 신청 하 ㄴ 17 이 ㅂ니다 . 학부 이 므로 세부 학과 까지 1 지망 부터 4 지망 까지 모두 선택 하 어서 내 ㄴ 상황 이 ㄴ데 , 갑자기 1 지망 과 2 지망 을 바꾸 고 싶 어 지 었 어요 .. 8 ㅅ 8 ... 혹시 지금 혹은 결과 나오 ㄴ 후 에 이 라도 바꾸 ㄹ 수 있 는지 여쭈 어 보 고 싶 습니다 . 이중 전공 을 1 회 바꾸 ㄹ 수 있 는 거 ㄹ 알 는데 , 인원 제한 이 없 는 영어 통 번역 학부 심지어 그 내부 의 학과 바꾸 는 데 에 그 1 회 를 사용 하 어야 하 는지요 ? 그렇 게 하 지 않 고 그냥 바꾸 ㄹ 수 있 는 방법 은 없 나요 ?",,
1139,이중전공,안녕하세요 교환학생 관련 문의합니다.저는 교환학생을 1년 가고싶은데 제가 알기로 4학년 1학기때가면 4학년 2학기가 막학기이므로 불가능하다고 알고 있는데요. 저 같은 경우는 후기이중전공때문에 학교를 더 다녀야하는데(4학년 2학기가 막학기가 아닌경우) 이런경우에는  교환학생으로 1년 있다 올수 있지 않나요? 아님 4학년때 1학기는 교환 2학기는 파견/자비유학 이런식으로 갔다와야하는건가요? ㅠㅠ 도와주세요,안녕하세요 교환 학생 관련 문의 하 ㅂ니다 . 저 는 교환 학생 을 1년 가 고 싶 은데 제 가 알 기 로 4 학년 1 학기 때 가 면 4 학년 2 학기 가 막 학기 이 므로 불 가능 하 다고 알 고 있 는데요 . 저 같 은 경우 는 후기 이중전공 때문 에 학교 를 더 다니 어야 하 는데 ( 4 학년 2 학기 가 막 학기 가 아니 ㄴ 경우 ) 이런 경우 에 는 교환 학생 으로 1년 있다 오 ㄹ 수 있 지 않 나요 ? 아 님 4 학년 때 1 학기 는 교환 2 학기 는 파견 / 자비 유학 이런 식 으로 갔다오 어야 하 는 거 이 ㄴ가요 ? ㅠㅠ 돕 어 주 세 요,,
1140,부전공,"한 학기 남았는데 너무 방탕하게 살았는지 졸업요건 채우려면 본전공+부전공 포함해서 24학점 남았어요.. 이걸 2018-1학기에 다 듣거나, 혹은 20학점정도 듣고 나머지를 여름 계절학기로 채우는게 가능한가요? 불가능하다면 포기하고 9학기 다니려구요..ㅜㅜㅜ","한 학기 남 었 는데 너무 방탕 하 게 살 었 는지 졸업 요건 채우 려면 본 전공 + 부전공 포함 하 어서 24 학점 남 었 어요 .. 이거 ㄹ 2018 - 1 학기 에 다 듣 거나 , 혹은 20 학점 정도 듣 고 나머지 를 여름 계절 학기 로 채우 는 것 이 가능 하 ㄴ가요 ? 불 가능 하 다면 포기 하 고 9 학기 다니 려구요 .. ㅜㅜㅜ",,
1141,이중전공,수고많으십니다!!이중전공 1지망을 합격하면 합격포기하고 2지망으로 택할 수 있나요??,수고 많 으시 ㅂ니다 !! 이중전공 1 지망 을 합격 하 면 합격 포기 하 고 2 지망 으로 택하 ㄹ 수 있 나요 ??,,
1142,이중전공,안녕하세요 고생이 많으십니다 이중전공 부전공 여쭤보고 싶어서요이중a 하다가 부전b 하다가 이중b로 변경이 가능한가요~?,안녕하세요 고생 이 많 으시 ㅂ니다 이중전공 부전공 여쭈 어 보 고 싶 어서 요 이 중 a 하 다가 부전 b 하 다가 이 중 b 로 변경 이 가능 하 ㄴ가요 ~ ?,,
1143,이중전공,이중전공을 바꾸려고 하는데 재수강 관련해서 여쭤봅니다.한 학기 들어보니 이중전공이 안 맞는 것 같아서 바꾸려고 하는데 한 과목이 씨쁠이 떠서 계속 눈에 밟히는데 그렇다고 그 수업을 또 들어야한다니 진저리가 나고...바꾸는 이중전공으로 재수강이 연결되지는 않겠죠?ㅠㅠ,이중 전공 을 바꾸 려고 하 는데 재수강 관련 하 어서 여쭈 어 보 ㅂ니다 . 한 학기 듣 어 보 니 이중전공 이 안 맞 는 것 같 어서 바꾸 려고 하 는데 한 과목 이 씨쁠 이 뜨 어서 계속 눈 에 밟히 는 데 그렇 다고 그 수업 을 또 듣 어야 하 ㄴ다니 진저리 가 나 고 ... 바꾸 는 이중전공 으로 재수강 이 연결 되 지 는 않 겠 죠 ? ㅠㅠ,,
1144,부전공,조교님 안녕하세요! 다름이 아니오라 부전공을 변경하고싶은데 제가 군휴학을 해야되서요1.부전공 변경기간은 아직인가요?2. 부전공 변경을 한 후 군휴학을 해도 되나요?항상 감사합니다 ㅠㅠ,조교 님 안녕하세요 ! 다르 ㅁ 이 아니 오 라 부전공 을 변경 하 고 싶 은데 제가 군 휴학 을 해야되서요1. 부전공 변경 기간 은 아직 이 ㄴ가요 ? 2 . 부전공 변경 을 하 ㄴ 후 군 휴학 을 하 어도 되 나요 ? 항상 감사 하 ㅂ니다 ㅠㅠ,,
1145,부전공,"조교님 중복과목 이수 질문드려요.제가 1전공,부전공 모두 공대를 희망합니다.시간표를 계획하다보니, 중복되는 과목은 많은데 수강편람의 중복수강금지 교과목현황에는 나와있지 않더군요. 예를들어, 논리회로및실험(T05306101)과 논리회로및실험(T05305201)은 서로 다른 과 교수님의 수업입니다. 권장학년도 다르구요. 위의 두 과목은 동일과목인지는 오늘 과에 물어봤는데 18년수강편람이 나오면 그때 확인하라십니다.진짜 질문은, A과 교수님의 논리회로및실험(T05306101)을 수강하고 후에 B과인 부전공학점으로 변경신청이 가능한지요? (이런 경우가 있었나요","조교 님 중복 과목 이수 질문 드리 어요 . 제 가 1 전공 , 부전공 모두 공대 를 희망 하 ㅂ니다 . 시간표 를 계획 하 다 보 니 , 중복 되 는 과목 은 많 은데 수강편람 의 중복 수강 금지 교과목 현황 에 는 나오 어 있 지 않 더군요 . 예 를 들 어 , 논리회로 및 실험 ( T 05306101 ) 과 논리 회로 및 실험 ( T 05305201 ) 은 서로 다른 과 교수 님 의 수업 이 ㅂ니다 . 권장 학년도 다르 구요 . 위 의 두 과목 은 동일 과목 이 ㄴ지 는 오늘 과 에 물어보 었 는데 18년수강편람 이 나오 면 그때 확인 하 라 시 ㅂ니다 . 진짜 질문 은 , A 과 교수 님 의 논리 회로 및 실험 ( T 05306101 ) 을 수강 하 고 후 에 B 과 인 부전공 학점 으로 변경 신청 이 가능 하 ㄴ 지요 ? ( 이런 경우 가 있 었 나요",,
1146,이중전공,이중전공 신청한거 부전공으로 못내리나요?,이중전공 신청 하 ㄴ 거 부전공 으로 못 내리 나요 ?,,
1147,부전공,부전공을 다른 걸로 하다가 변경 때 원하는 학과 도전아니면이중 신청 기간에 도전 둘 중에 뭐가 낫나요..???,부전공 을 다른 거 ㄹ로 하 다가 변경 때 원하 는 학과 도 저 ㄴ 아니 면 이중 신청 기간 에 도 저 ㄴ 둘 중 에 뭐 가 낫 나요 ..???,,
1148,이중전공,안녕하세요! 부전공에서 이중전공으로 올리는 방법이 무엇인가요 ㅠㅠ?,안녕하세요 ! 부전공 에서 이중전공 으로 올리 는 방법 이 무엇 이 ㄴ가 요 ㅠㅠ ?,,
1149,이중전공,조교님 안녕하세요 이중전공 변경 관련해 질문드립니다.이중전공 A->부전공 B->이중전공B이중전공 A를 부전공 B로 변경하고 부전공 B를 이중으로 올리는 것이 가능한가요..? 횟수제한이 있는거로 알고있어서 ..ㅠㅠ,조교 님 안녕하세요 이중전공 변경 관련 하 어 질문 드리 ㅂ니다 . 이중전공 A - > 부전공 B - > 이중전공 B 이중전공 A 를 부전공 B 로 변경 하 고 부전공 B 를 이중 으로 올리 는 것 이 가능 하 ㄴ가요 ..? 횟수 제한 이 있 는 거 로 알 고 있 어서 .. ㅠㅠ,,
1150,이중전공,조교님 고생하십니다 부전공 관련해 여쭈어봅니다 제가 이중전공 A -> 부전공 B 로 변경한 상태입니다 부전공 B -> 부전공 C 로 다시 변경 가능한가요?부전공 변경 횟수가 1번 혹은 2번으로 알고있는데 2번 변경가능한가요?,조교 님 고생 하 시 ㅂ니다 부전공 관련 하 어 여쭈 어 보 ㅂ니다 제가 이중전공 A - > 부전공 B 로 변경 하 ㄴ 상태 이 ㅂ니다 부전공 B - > 부전공 C 로 다시 변경 가능 하 ㄴ가요 ? 부전공 변경 횟수 가 1 번 혹은 2 번 으로 알 고 있 는데 2 번 변경 가능 하 ㄴ가요 ?,,
1151,이중전공,안녕하세요 다음학기 복학예정인 14학번학생입니다 군대에서 진로에 대해 깊게 고민을 한결과 이중전공을 융합소프트웨어나 문화콘텐츠로 변경을 하려고 하는데요 기존에는 제가 경제 이중전공을 희망하다가 학점때문에 떨어지고 부전공을 경제로한뒤 이중전공 변경 기간에 경제를 이중으로 올리려고 생각을 했었습니다. 일반전공은 이런식으로 변경하는게 맞는거 같은데 융합전공도 동일하게 가능한지 궁금합니다 지금 부전공이 경제인 상태인데 마찬가지로 이중전공변경신청기간에 융합소프트웨어나 문화콘텐츠 신청하면 되는건가요 이중변경은 티오가 있어야하는걸로 아는데 찾아보니 융합소프트웨어는 중간변경은 안된,안녕하세요 다음 학기 복학 예정 이 ㄴ 14 학번 학생 이 ㅂ니다 군대 에서 진로 에 대하 어 깊 게 고민 을 하 ㄴ 결과 이중전공 을 융합 소프트웨어 나 문화콘텐츠 로 변경 을 하 려고 하 는데요 기존 에 는 제가 경제 이중전공 을 희망 하 다가 학점 때문 에 떨어지 고 부전공 을 경제 로 하 ㄴ 뒤 이중전공 변경 기간 에 경제 를 이중 으로 올리 려고 생각 을 하 었었 습니다 . 일반 전공 은 이런 식 으로 변경 하 는 것 이 맞 는 거 같 은데 융합전공 도 동일 하 게 가능 하 ㄴ지 궁금 하 ㅂ니다 지금 부전공 이 경제인 상태 이 ㄴ데 마찬가지 로 이중전공 변경 신청 기간 에 융합 소프트웨어 나 문화콘텐츠 신청 하 면 되 는 거 이 ㄴ가요 이중 변경 은 티오 가 있 어야 하 는 거 ㄹ로 알 는데 찾아보 니 융합 소프트웨어 는 중간 변경 은 안 되 ㄴ,,
1152,이중전공,제가 2학년 2학기때 이중전공을 경영으로 변경신청을 했는데시험에서 떨어졌어요.. 그럼 변경신청을 했지만 떨어진거니까다음 학기때 경영학점을 미리 들어놓고 다시 신청기간에 신청할 수 있는건가요..? 아님 시험에서 떨어졌으니 경영으로 부전공 처리가 되는건거요...? 도와주세요...!,제가 2 학년 2 학기 때 이중전공 을 경영 으로 변경 신청 을 하 었 는데 시험 에서 떨어지 었 어요 .. 그럼 변경 신청 을 하 었 지만 떨어지 ㄴ 거 이 니까 다음 학기 때 경영학 점 을 미리 듣 어 놓 고 다시 신청 기간 에 신청 하 ㄹ 수 있 는 거 이 ㄴ가요 ..? 아 님 시험 에서 떨어지 었 으니 경영 으로 부전공 처리 가 되 는 거 이 ㄴ 거 이 오 ...? 도와주 시 어요 ...!,,
1153,이중전공,과에서 정한 기준을 충족시키지 못하면 후기 이중전공도 떨어질 수 있나요?,과 에서 정하 ㄴ 기준 을 충족 시키 지 못하 면 후기 이중전공 도 떨어지 ㄹ 수 있 나요 ?,,
1154,이중전공,안녕하세요 조교님! 혹시 이중전공 신청한것 다른 전공으로 바꿀 수 있은 기간이 있나요??,안녕하세요 조교 님 ! 혹시 이중전공 신청 하 ㄴ 것 다른 전공 으로 바꾸 ㄹ 수 있 은 기간 이 있 나요 ??,,
1155,이중전공,eicc 수강신청할때 이중전공생은 1전공 수업 못듣나요?,eicc 수강 신청 하 ㄹ 때 이중전공 생 은 1 전공 수업 못 듣 나요 ?,,
1156,이중전공,이중전공 신청한 거 모두 포기하고부전공 신청하려면 어떻게 해애 하나요?,이중전공 신청 하 ㄴ 거 모두 포기 하 고 부전공 신청 하 려면 어떻 게 하 어 애 하나 이 요 ?,,
1157,이중전공,일부러 5학년 1학기 남기고 싶은데전공이나 이중전공 학점 남겨야만 하나요??혹시 학점이수 다 하고 교양 재수강만 5학년 1학기때 할 수 있나요?? 아님 토익점수 안내면 자동 유예되는거 이용해서 5학년1학기때 교양 재수강할 수 있나요??,일부러 5 학년 1 학기 남기 고 싶 은데 전공 이나 이중전공 학점 남기 어야 만 하 나요 ?? 혹시 학점 이 수 이 다 하 고 교양 재수강 만 5 학년 1 학기 때 하 ㄹ 수 있 나요 ?? 아 님 토익 점수 안내면 자동 유예 되 는 거 이용 하 어서 5 학년 1 학기 때 교양 재수강 하 ㄹ 수 있 나요 ??,,
1158,부전공,부전공이 스페인어고 본전공은 영어인데교환을 스페인으로가려고하는데요!그런데학점인정을 영어로진행되는 영어전공수업으로 들으면 본전공인정 받을수있는거죠? 교환가기전에 허락맡고가야되는건가요?,부전공 이 스페인어 고 본 전공 은 영어 이 ㄴ데 교환 을 스페인 으로 가 려고 하 는데요 ! 그런데 학점 인정 을 영어 로 진행 되 는 영어 전공 수업 으로 듣 으면 본 전공 인정 받 을 수 있 는 거 이 죠 ? 교환 가 기 전 에 허락 맡 고 가 어야 되 는 거 이 ㄴ가요 ?,,
1159,이중전공,안녕하세요 조교님! 날씨가 쌀쌀한데도 수고많으십니다!내년 4월에 군대가려고 계획 중인 17입니다.그래서 이번 학기 마치고 휴학하려고 하는데 이게 이중전공에 영향을 끼치진 않겠죠??예를 들어 ‘2학년 1학기를 등록하고 휴학을 해야 신청했던이중전공이 정상적으로 등록 된다’ 같은?,안녕하세요 조교 님 ! 날씨 가 쌀쌀 하 ㄴ데 도 수고 많 으시 ㅂ니다 ! 내년 4 월 에 군대 가 려고 계획 중 이 ㄴ 17 이 ㅂ니다 . 그래서 이번 학기 마치 고 휴학 하 려고 하 는데 이 게 이중전공 에 영향 을 끼치 지 ㄴ 않 겠 죠 ?? 예 를 들 어 ‘ 2 학년 1 학기 를 등록 하 고 휴학 을 하 어야 신청 하 었 던 이중 전공 이 정상 적 으로 등록 되 ㄴ다 ’ 같 은 ?,,
1160,이중전공,17학번인데 2학기 휴학했고 내년1학기에 복학예정이거든요~그러면 1학기 말쯤에 이중전공을 신청하게 된다고 알고 있는데선발기준? 이런게 보통17들이 11월에 신청했을 때의 선발기준과 달라지나요?? 남은 자리에 들어가는 식인가요..?,17 학번 이 ㄴ데 2 학기 휴학 하 었 고 내년 1 학기 에 복학 예정 이 거든요 ~ 그러면 1 학기 말 쯤 에 이중전공 을 신청 하 게 되 ㄴ다고 알 고 있 는데 선발 기준 ? 이런 게 보통 17 들 이 11월 에 신청 하 었 을 때 의 선발 기준 과 다르 어 지 나요 ?? 남은 자리 에 들어가 는 식 이 ㄴ가요 ..?,,
1161,이중전공,안녕하세요 조교님부전공 경영에서 이중전공으로 올리는 것은 학년별 티오에 따라 가능한거잖아요!만약 제가 내년에 17티오로 시험을 봤는데 못올릴 경우 내후년 혹은 다른해에 또 티오가 날 경우 신청이 가능한지 궁금합니다!,안녕하세요 조교님 부전공 경영 에서 이중전공 으로 올리 는 것 은 학년 별 티오 에 따르 어 가능 하 ㄴ 거 이 잖아요 ! 만약 제 가 내년 에 17티오 로 시험 을 보 었 는데 못 올리 ㄹ 경우 내후년 혹은 다른 해 에 또 티오 가 나 ㄹ 경우 신청 이 가능 하 ㄴ지 궁금 하 ㅂ니다 !,,
1162,이중전공,조교님 ㅜㅜ 제가 불안해서 여쭤봅니다ㅜㅜ이중전공 조건같은경우 학과 홈페이지 공지에 따로 기재되어있지 않으면 없는거 맞나요?,조교 님 ㅜㅜ 제 가 불안 하 어서 여쭈 어 보 ㅂ니다 ㅜㅜ 이중전공 조거 이 ㄴ 같 은 경우 학과 홈페이지 공지 에 따로 기재 되 어 있 지 않 으면 없 는 거 맞 나요 ?,,
1163,이중전공,안녕하세요 조교님!!1학년1학기재학후 휴학한다음 다음학기 복학예정인 학생입니다. 제가 1학년 1학기성적 이 너무 망했는데 1학년 2학기때 이중전공신청을 한다고 알고있습니다.성적 복구를 해야할 것같은데 휴학후 계절학기로 휴학전 학기를 성적복구가가능한가요??,안녕하세요 조교 님 !! 1 학년 1 학기 재학 후 휴학 하 ㄴ 다음 다음 학기 복학 예정 이 ㄴ 학생 이 ㅂ니다 . 제가 1 학년 1 학기 성적 이 너무 망하 었 는데 1 학년 2 학기 때 이중전공 신청 을 하 ㄴ다고 알 고 있 습니다 . 성적 복구 를 하 어야 하 ㄹ 것 같 은데 휴학 후 계절 학기 로 휴학 전 학기 를 성적 복구 가 가능 하 ㄴ가요 ??,,
1164,이중전공,조교님! 제가 이번에 이중전공을 신청했는데요내년 5월에 이중전공 신청기간이 한번 더 있다는말을 들었습니다. 그때 학점순으로 뽑는다면 올해2학기와 내년1학기 성적평균으로 보는건가요 이전 모든학기 평균으로 보는건가요? 그리고 5월신청때는 경쟁률이 지금보다 좀 덜한지도 궁금합니다! 답변감사합니다,조교 님 ! 제가 이번 에 이중전공 을 신청 하 었 는데요 내년 5 월 에 이중전공 신청 기간 이 한 번 더 있 다는 말 을 듣 었 습니다 . 그때 학점 순 으로 뽑 는다면 올해 2 학기 와 내년 1 학기 성적 평균 으로 보 는 거 이 ㄴ가요 이전 모든 학기 평균 으로 보 는 거 이 ㄴ가요 ? 그리고 5월 신청 때 는 경쟁 률 이 지금 보다 좀 덜 하 ㄴ 지 도 궁금 하 ㅂ니다 ! 답변 감사 하 ㅂ니다,,
1165,전공심화,안녕하세요 조교님 제가 이번에 이중을 신청안했는데 내년 1학기때 신청할려고 합니다 근데 제가 자연스럽게 전공심화가 되는 건가요?,안녕하세요 조교 님 제 가 이번 에 이중 을 신청 안 하 었 는데 내년 1 학기 때 신청 하 ㄹ려고 하 ㅂ니다 근데 제 가 자연 스럽 게 전공심화 가 되 는 거 이 ㄴ가요 ?,,
1166,이중전공,조교님 서울캠 영어대 내 학과중 하난데 다른 영어대 내 학과 이중전공 신청 가능하죠?,조교 님 서울 캠 영어 대 내 학과 중 하나 이 ㄴ데 다른 영어 대 내 학과 이중전공 신청 가능 하 죠 ?,,
1167,이중전공,조교님 안녕하세요!이중신청에 관해서 여쭤볼게 있습니다 혹시 이중전공을 신청했고 붙었는데 아예 안하는 경우도 가능한가요?..(미루는게 아니라),조교 님 안녕 하 시 어요 ! 이 중 신청 에 관하 어서 여쭈 어 보 ㄹ게 있 습니다 혹시 이중전공 을 신청 하 었 고 붙 었 는데 아예 안 하 는 경우 도 가능 하 ㄴ가요 ?.. ( 미루 는 게 아니 라 ),,
1168,이중전공,안녕하세요 조교님!부전공으로 하고 이중전공돌리는게 많이 힘들까요?ㅠ이중으로 돌리는 것도 해당되는 과에 티오가 있으면 되는 걸로 아는데 또 다른 조건있나요?- 항상 답변해주셔서 정말 감사해요! 많이 배워갑니다ㅠㅠ 건강하세용 !,안녕하세요 조교 님 ! 부전공 으로 하 고 이중전공 돌리 는 것 이 많이 힘들 ㄹ까요 ? ㅠ 이중 으로 돌리 는 것 도 해당 되 는 과 에 티오 가 있 으면 되 는 거 ㄹ로 알 는데 또 다른 조건 있 나요 ? - 항상 답변 하 어 주 시 어서 정말 감사 하 어요 ! 많이 배우 어 가 ㅂ니다 ㅠㅠ 건강 하 세 용 !,,
1169,이중전공,조교님! 이중전공으로 융복합소프트웨어를 신청하려고 하는데요!신청페이지 보니까 글로벌캠퍼스에 공과대학이라고 나와있더라구요1. 졸업장에는 글캠으로 찍혀나오나요?2. 글캠이니까 수업들으러 글캠으로 가야하나요??,조교 님 ! 이중전공 으로 융복 합 소프트웨어 를 신청 하 려고 하 는데요 ! 신청 페이지 보 니까 글로벌 캠퍼스 에 공과대학 이 라고 나오 어 있 더라구요 1 . 졸업장 에 는 글캠 으로 찍히 어 나오 나요 ? 2 . 글캠 이 니까 수업 듣 으러 글캠 으로 가 어야 하 나요 ??,,
1170,이중전공,안녕하세요 이중전공 a - 부전공 b - 이중전공 c - 부전공 d 의 과정으로 부전공 d로 변경하는 게 가능한지 알고싶어요!,안녕하세요 이중전공 a - 부전공 b - 이중전공 c - 부전공 d 의 과정 으로 부전공 d 로 변경 하 는 것 이 가능 하 ㄴ지 알 고 싶 어요 !,,
1171,이중전공,내년 2월에 군입대 하더라도 이번에 이중전공 신청해야 하나요??도와주세요 조교님 !,내년 2 월 에 군 입대 하 더라도 이번 에 이중전공 신청 하 어야 하 나요 ?? 도와주 시 어요 조교 님 !,,
1172,이중전공,"조교님! 제가 미컴이중을 신청하고 싶은데 만약 떨어졌을경우 부전공을 하려합니다. 그런데 부전공을 이중으로 변경하려면 1.학기중에 이중으로 변경신청 (티오나면 가능) 2.후기이중전공 이렇게 두개방법이 있는걸로 아는데 1번경우가 많이 힘든지,배정기준은 뭔지 궁금합니다. 그리고 2번경우는 4년안에 졸업하기가 힘든지도 궁금합니다. 답변감사합니다.","조교 님 ! 제가 미컴이중 을 신청 하 고 싶 은데 만약 떨어지 었 을 경우 부전공 을 하 려 하 ㅂ니다 . 그런데 부전공 을 이중 으로 변경 하 려면 1 . 학기 중 에 이중 으로 변경 신청 ( 티오나 이 면 가능 ) 2 . 후기 이중전공 이렇게 두 개 방법 이 있 는 거 ㄹ로 알 는데 1 번 경우 가 많이 힘들 ㄴ지 , 배정 기준 은 뭐 이 ㄴ지 궁금 하 ㅂ니다 . 그리고 2 번 경우 는 4 년 안 에 졸업 하 기 가 힘들 ㄴ 지 도 궁금 하 ㅂ니다 . 답변 감사 하 ㅂ니다 .",,
1173,부전공,"조교님!국제지역대학 1학년 학생입니다부전공 신청해서 후기이중전공으로 가려 한다면6학기까지 1전공, 이중/부전공 이수학점체계는어떻게 되나요?","조교 님 ! 국제 지역 대학 1 학년 학생 이 ㅂ니다 부전공 신청 하 어서 후기 이중 전공 으로 가 려 하 ㄴ다면 6 학기 까지 1 전공 , 이중 / 부전공 이수 학점 체계 는 어떻 게 되 나요 ?",,
1174,이중전공,조교님! 글켐 통대에 재학중인 17입니다 이중전공으로 문화콘텐츠학과 전공 하려고 하는데 학점은 평균 몇점대 정도 돼야하나요?ㅠㅠ 제가 학점이 많이 낮아서ㅠㅠ 그리고 배정기준이 전체선발이라고 돼있는데 무슨말인가요?,조교 님 ! 글 하 게 ㅁ 통대 에 재학 중 이 ㄴ 17 이 ㅂ니다 이중전공 으로 문화콘텐츠 학과 전공 하 려고 하 는데 학점 은 평균 몇 점 대 정도 되 어야 하 나요 ? ㅠㅠ 제가 학점 이 많이 낮 어서 ㅠㅠ 그리고 배정 기준 이 전체 선발 이 라고 되 어 있 는데 무슨 말 이 ㄴ가요 ?,,
1175,이중전공,"조교님!! 제가 마인어를 이중전공을 할건데요, 나중에 인도네시아 해외유학이나 연수 그런제도가 마련되어있나요? 1전공생들과의차별이 많이심할까요? 궁금합니다!","조교 님 !! 제가 마인 어 를 이중전공 을 하 ㄹ 거 이 ㄴ데요 , 나중 에 인도네시아 해외 유학 이나 연수 그런 제도 가 마련 되 어 있 나요 ? 1 전공 생 들 과 의 차별 이 많이 심하 ㄹ까요 ? 궁금 하 ㅂ니다 !",,
1176,이중전공,이중전공을 듣다가 다른걸로 바꾼 경우에는 처음부터  이중 학점을 채워야하나요? 아니면 인정해주나요?,이중전공 을 듣 다가 다른 거 ㄹ로 바꾸 ㄴ 경우 에 는 처음 부터 이중 학점 을 채우 어야 하 나요 ? 아니면 인정 하 어 주 나요 ?,,
1177,이중전공,"안녕하세요 조교님이중전공때문에 질문 올립니다경제나 경영, 전공심화 셋중하나 부전공 할생각인데 이중 아무거나 신청했다 떨어져도 부전공은 여전히 자유롭게 신청가능하죠?","안녕하세요 조교님 이중전공 때문 에 질문 올리 ㅂ니다 경제 나 경영 , 전공심화 셋 중 하나 부전공 하 ㄹ 생각 이 ㄴ데 이 중 아무거 나 신청 하 었 다 떨어지 어도 부전공 은 여전히 자유 롭 게 신청 가능 하 죠 ?",,
1178,이중전공,저는 수학과고생공에 일반생물학및실험이라는 과목이 있고바메공에도 일반생물학실험이 있어요.근데 제가 바메공을 이중전공 할건데 생공의 일반생물학을 이미 수강했습니다. 그러면 같은과목이니까 바메공 전공으로 인정해주나요?,저 는 수학 과 고생 공 에 일반 생물학 및 실험 이 라는 과목 이 있고바메공 에 도 일반 생물학 실험 이 있 어요 . 근데 제 가 바메공 을 이중전공 하 ㄹ 거 이 ㄴ데 생공 의 일반 생물학 을 이미 수강 하 었 습니다 . 그러면 같 은 과목 이 니까 바메 공 전공 으로 인정 하 어 주 나요 ?,,
