,내용,분류,명사토큰
1315,14학번 영어대 졸업요건 이게 맞나요?영어어학점수기타어학점수(한자or한국어or제2외국어)학점-전공54 부전공21 실외(교양외국어)4 +그외필수과목이수-남는 학점은 아무거나(타과과목포함) 채워서 134이수,8,학번 영어 졸업 요건 이 영어 학점 어학 점수 한자 한국어 제 외국어 학점 전공 부 전공 실외 교양 외국어 외 필수 과목 이수 학점 거나 타 과목 포함 이수
1316,"재수강 연결 질문1. 수강한 과목이 폐강되서 다른 과목으로 연결해야 되는데전에 들은 건 2학점짜리고 연결과목는 3학점입니다. 이 경우 재수강시 3학점으로 인정되나요?2. 수강과목은 1,2나눠진 과목이 아닌데 연결과목은 1,2가 있습니다. 이 경우 1,2 중 아무거나 들으면 되나요?",4,재수강 연결 질문 수강 과목 폐강 다른 과목 건 학점 리 연결 과목 학점 이 경우 재수 강시 학점 인정 수강 과목 과목 연결 과목 이 경우 중 거나
1317,조교님 안녕하세요! 성적장학금 기준이 14학점 이상이던데 P/F강의가 2학점 포함된 14학점도 성적장학금 대상인가요? 아니면 16학점을 들어야하는건가요?,8,조교 성적 장학금 기준 학점 이상 데 강의 학점 포함 학점 성적 장학금 대상 학점 가요
1318,조교님 안녕하세요제가 통대생인데 올해 1학기때 19학점을 수강하고 여름학기에 2학점을 수강했는데요이렇게 되면 2학기에 이월가능한 학점이 3학점인가요 아니면 1학점 인가요?,8,조교 제 통 생 올해 학기 때 학점 수강 여름 학기 학점 수강 학기 이월 학점 학점 학점
1319,조교님 안녕하세요! 현재 영어대학에서 1전공 2전공을 모두 하고 있습니다. 이중전공 학점 인정과 관련하여 여쭤볼 것이 있습니다.저는 두 전공 모두 영어대에 속하기 때문에 영어대 교류를 통해 수업을 수강할 수 있습니다. 혹시 1전공에서 영어대 교류라고 적힌 수업을 듣고 2전공으로 교류 신청을 해서 학점인정을 받을 수 있나요? 물론 이중전공 전용수업이 아닌 본전공 전용수업으로 할 예정입니다.확인 부탁드립니다. 감사합니다.,2,조교 현재 영어 대학 전공 전공 모두 이중 전공 학점 인정 관련 볼 것 저 두 전공 모두 영어 속 때문 영어 교류 통해 수업 수강 수 혹시 전공 영어 교류 수업 전공 교류 신청 학점 인정 수 이중 전공 전용 수업 전공 전용 수업 예정 확인
1320,"조교님 안녕하세요!이수영영 변경 관련하여 문의드립니다현재 졸업까지 6학점이 남은상황에 영역별 최소이수학점 영역중 교양영역이 1학점이 부족한 상태입니다. 하지만 자선이 15학점, 기타 전공과 부전공은 최소이수학점을 초과한 상태인데요이럴경우 자선이나 전공 및 부전공의 이수학점을 교양영역으로 바꾸는 것이 가능한지요? 자선의 경우 기존에 들었던 다른 부전공 과목들이 자선으로 넘어갔습니다. 감사합니다!",8,조교 이수 영영 변경 관련 문의 현재 졸업 학점 상황 영역 별 최소 학점 영역 교양 영역 학점 상태 자선 학점 기타 전공 부 전공 최소 학점 초과 상태 요 경우 자선 전공 및 부 전공 학점 교양 영역 것 자선 경우 기존 다른 부 전공 과목 자선
1321,안녕하세요 조교님 :) 여름 잘 보내시고 계신가요??이렇게 게시판에 글 달아주시고 도움주셔서 항상 정말 너무 감사드립니다.다름이 아니라 제가 지금 도저히 부전공A가 너무 맞지 않아 부전공B 바꾸려고 합니다.1) 이 경우에도 5월 / 11월로 알고 있는 이중(?) 부전공 변경 신청 때 변경 가능한 건가요?2) 이 경우도 (부전공에서 부전공으로 바뀌지만) 바꾸려는 부전공에 따라 학점이나 티오 등의 제한이 있나요? (이중변경 시 제한이 있어 여쭙니다!) 3) 부전공B로 변경 후 나중에 이 B를 후기 이중이나 기회를 통해 이중 전공으로 올릴 기회가 주어질까요?ㅠ (부전공 A> 부전공 B 변경시 부전공 B로 고정일까요?ㅠ)4) 바꿀 부전공B의 학점을 미리 인정 받을 방법이 있을까요?너무 많은 질문을 드린 것 같아 죄송합니다.주변에서는 부전공인데 왜 이렇게 연연하냐 그냥 듣고 잘 졸업하라 등의 말이 많은데 제게 너무 맞지 않아 고민에 고민 끝네 이렇게 글 남겨 봅니다.. 실례가 되지 않으신다면 답 달아 주신다면 정말 감사드리겠습니다 ??더운 여름 잘 보내시길 바랍니다 ??,2,조교 여름 게시판 글 도움 항상 정말 감사 제 지금 도저히 부 전공 부 전공 이 경우 알 이중 부 전공 변경 신청 때 변경 건가 이 경우 부 전공 부 전공 부 전공 학점 티오 등 제한 이중 변경 시 제한 부 전공 로 변경 후 나중 이 를 후기 이중 기회 통해 이중 전공 기회 요 부 전공 부 전공 변경 시 부 전공 로 정일 부 전공 의 학점 미리 인정 방법 질문 것 주변 부 전공 왜 그냥 졸업 등 말 제 고민 고민 끝 글 실례 답 달 정말 감사 여름
1322,"안녕하세요 조교님~~다름이 아니라, 제가 지금 졸업학점을 사실상 다 채웠는데, 전공교류가 되는 한 과목학점을 아직 전공과목학점으로 신청을 안해서 자선에 들어가있는 상태입니다! 그래서 지금 졸업유예가 아니라, 학점이 부족한 상태로 남아있는 중인데요, 제가 최대한 졸업을 미뤄야 하는 상황입니다!근데 제가 저 학점을 전공으로 돌려버리면 학점은 다 채워져서 졸업유예 상태가 되어버리잖아요, 그래서 말인데 혹시 전공과목학점신청을 최대한 미루면 그 기간동안은 휴학생 신분으로 남을 수 있나요~ ? 혹시 전공과목학점으로 변환신청에 기한이 있을까요?~ 늘 감사합니다^^",8,조교 제 지금 졸업 학점 사실 교류 과목 학점 과목 학점 신청 안해 자선 상태 지금 졸업 유예 학점 상태 중 요 제 최대한 졸업 상황 제 저 학점 전공 학점 졸업 유예 상태 말 혹시 과목 학점 신청 최대한 그 기간 동안 휴학생 신분 남 수 혹시 과목 학점 변환 신청 기한 늘
1323,"조교님, 항상 수고 많으십니다.다른 질문에 비해 너무 간단한 질문이라 민망하지만2학점 강의를 1학점 강의로 재수강연결이 가능하나요?",8,조교 항상 수고 다른 질문 질문 학점 강의 학점 강의 재수강 연결
1324,"조교님! 1학기때 칠플을다녀와서 12학점을 들었는데이번학기 신청할때 21을 들을수 있는지요? 학점이 연간 40으로 제한 되어 있어서, 한학기를 덜 들으면 남은 학기를 더 들어도 된다고 들어서요 ㅎㅎ",1,조교 학기 때 칠 학점 이번 학기 신청 때 학점 연간 제한 학기 덜 학기 더
1325,"조교님 안녕하세요, 저는 7학기를 앞두고 있는 14학번 입니다. 저는 현재 전공 54 교양 26을 채워 놓은 상태입니다.이중전공 들었던 과목들은 변경되어서 자선으로 넘어간 상태이구요.즉, 이중전공을 제외한 이수학점은 다 채워놓았습니다다음학기 부터 새로 듣게될 부전공을 후기 이중으로 올릴 계획을 앞두고 있습니다. 그래서 다음학기 부터는 부전공과목(추후에 후기이중이될 과목)만 들을 계획인데요,  제가 20년 4월, 그러니까 제가 후기이중을 신청할 시기에 저는 이번 19-2 부전공 18, 그리고 내년 20-1에 18을 들어 놓을 계획이 있습니다.   여쭈어 보고 싶은것은, 후기 이중을 신청할 시기에 ""졸업에 맞는 전체학점 이수""를 해야 한다고 했는데,그 학점이 전공54 부전공21 교양 26이 맞는지요? , ""자선""은 따로 들을 필요가 없는게 맞겠지요?그래서 제가 신청할때 저는 아마 전공54 부전공36 교양 26이 될텐데 이게 자격에 해당하는지요?감사합니다.",2,조교 저 학기 학번 저 현재 전공 교양 상태 이중 전공 과목 변경 자선 상태 이구 즉 이중 전공 제외 학점 다음 학기 부터 부 전공 후기 이중 계획 다음 학기 부전 과목 추후 후기 중이 과목 만 계획 요 제 제 후기 이중 신청 시기 저 이번 부 전공 내년 계획 보고 후기 이중 신청 시기 졸업 전체 학점 이수 를 그 학점 전공 부 전공 교양 이 자선 은 필요 제 신청 때 저 아마 전공 부 전공 교양 이 이 자격 해당
1326,"안녕하세요 조교님익씨를 이중전공하는 학생입니다. 영어대교류 과목을 수강하려고 하는데, 영어대타학과 수강신청함 비고란에영어대교류(이중)이라고 되어 있는 과목을 선택할 수 있는건가요?",4,조교 익 이중 전공 학생 영어 교류 과목 수강 영어 대타 학과 수강신청 함 비고 란 영어 교류 이중 과목 선택 수 가요
1327,조교님 안녕하세요! 수강인정 관련 질문드리려 합니다.본전공에서 ㅁㄴㅇㄹ 과목이 열리고 이중전공에서도 ㅁㄴㅇㄹ 라는 이름이 같은 과목이 개설됩니다.1) 하나만 들어도 두 전공에서 학점 인정이 되는것인지 택 1형식인지2) 이름 같은 과목을 동시에 수강해도 되는지질문드립니다.수강편람에는 동일학과라 가정하고 적혀있길래 질문드려요. 감사합니다!,4,조교 수강 인정 관련 질문 전공 과목 이중 전공 이름 과목 개설 하나 두 전공 학점 인정이 택 형식 이름 과목 동시 수강 질문 수강 편람 학과 가정 질문
1328,"조교님!  감사합니다! 정외, 행정, 언론정보, 광고 등등부전공으로 신청하면 설캠 수업 못 듣잖아요근데 제가 후기이중을 하려 하는데, 4-1에 글캠에서 들을수 있는 수업을 다 들으면 어떻게 되는 건가요? 후기이중전까지(4-2까지) 계속 부전공 신분 일텐데요 ㅠ",2,조교 정외 행정 언론 정보 광고 등등 부 전공 신청 설캠 수업 못 제 후기 이중 글캠 수업 건가 후기 중전 계속 부 전공 신분
1329,안녕하세요경영학 부전공학생입니다.부전공시 21학점만 이수해도 되는데경영학부 수업 3학점 경영학전공 수업을 18학점들었는데경영학부 수업이 자선으로 내려가 있더라구요ㅜㅜㅠ학종지가면 되나요?,8,경영학 부전 학생 부전 공시 학점 이수 경영 학부 수업 학점 경영학 전공 수업 학점 경영 학부 수업 자선 학 종지 가면
1330,항상 고생많으십니다! 조교님!이중전공을 부전공으로 내리려고 합니다ㅠ이중전공 27학점 들은 상태에서이 전공을 부전으로 내리면부전공 21학점으로 되고 나머지 6학점은 자선으로빠지나요?8학기 넘어서도 학종지에에서 변경가능하겠죠?흑흑,2,항상 고생 조교 이중 전공 부 전공 이중 전공 학점 상태 전공 부전 부 전공 학점 나머지 학점 자선 학기 학 종지 변경
1331,"안녕하세요 조교님!혹시 학고를 받으면 받게되는 불이익이 있나요?다음학기 학점 제한이라던지, 학점 이월이 안된다던지.. 알려주세요ㅠㅠ",8,조교 혹시 학 불이익 다음 학기 학점 제한 학점 이월
1332,안녕하세요 조교님! 수강신청 후 8월 말에 등록 못하면 수강신청내역이 바로 사라지나요? 아니면 9월 첫주까지 살아있나요?,3,조교 수강신청 후 말 등록 수강신청 역 바로 주
1333,안녕하세요 조교님! 중국어로 2학점 들었었는데 플렉스 일본어로 대체 가능한가요??ㅠ 또 대체라는것이 수업을 듣지 않고 시험만 보면 되는거죠? 계속 뒤져봤는데 안나와서요ㅠㅠㅠ 중국어 성적이 그대로 남아있어도 일본어로 인증만 되면 상관 없는데.. 14학번입니다,0,조교 중국어 학점 플렉스 일본어 대체 또 대체 것 수업 시험 계속 중국어 성적 그대로 일본어 인증 상관 학번
1334,"안녕하세요 조교님.현재 13학번입니다.성적취득현황에 실외 9학점, 교양 15학점 취득한 것으로 나오는데 그럼 졸업에 필요한 교양 26학점 중24학점을 취득한 상태라고 보면 될까요?",8,조교 현재 학번 성적 취득 현황 실외 학점 교양 학점 취득 것 졸업 교양 학점 중 학점 취득 상태 요
1335,조교님 안녕하세요.이중전공이 문화콘텐츠학 연계전공인 학생입니다. 문콘 수업을 재수강하고 싶은데 해당과목에 이번에 안 떠 있으면 다른과목으로 연결할 수 있나요?문화콘텐츠학은 홈페이지도 제대로 운영되지않고 있는 실정이라.. 자세한 사항은 어디로 문의하면 될까요?,4,조교 이중 전공 문화 콘텐츠 학 계전 공인 학생 문콘 수업 재수강 해당 과목 이번 안 과목 수 문화 콘텐츠 학 홈페이지 제대로 운영 실정 사항 어디 문의 요
1336,조교님! 조기졸업예정시에는 7학기때 교환이나 파견갈수없는건가요?,3,조교 조기졸업 정시 학기 때 교환 파견 갈수 가요
1337,조교님!!전 막학기인데 이중전공 학점을 다 못채울 위기에 있어요ㅠ 부전공으로 내려야 할 것 같은데 부전공 신청기간이 지났더라규요...... 막학기생은 학종지에서 바꿔준다고 들은 것 같은데 진짜인가요...?! 신청기간 지났는데 가능할까유??,5,조교 전 막 학기 이중 전공 학점 위기 부 전공 것 부 전공 신청 기간 규 막 학기 생 학 종지 것 진짜 신청 기간 유
1338,안녕하세요 조교님 재수강 문의 드립니다??1. 인간과사회에서 2학점짜리 교양을 들었고 씨쁠이 나왔는데요. 교양 재수강은 카테고리가 자유롭게 가능하잖아요 ㅠ 근데 이게 생활과 운동 카테고리 1학점 패논패로도 재수강이 가능할까요? 2.훕커디 저번학기 에프가 나왔는데 패논패일경우 에프야도 학점계산이 안되고 그냥 안 들은 것처럼 된다고 하더라고요. 그럼 이번 학기에 훕커디를 다시 들으려고 하는데 장바구니 담을때 재수강 체크를 하지 않아도 되는건가요? 감사합니다??,6,조교 재수강 문의 인간 사회 학점 교양 씨쁠 교양 재수강 카테고리 이 생활 운동 카테고리 학점 패논패 도 재수강 요 훕커디 저번 학기 에프 패논패일 경우 에프 도 학점 계산 그냥 안 것 이번 학기 훕커디 다시 장바구니 담 때 재수강 체크 가요
1339,"안녕하십니까 조교님,이번 2학기부터 교양 이수지침 변경과 관련하여 자선과목 학점을 교양학점으로 인정한다고 수강편람에 나왔는데요,여기서 이 교양학점으로 인정이 무엇인지 궁금합니다.예를 들어, 제가 경영학과 전공인데 자선으로 프랑스어과 수업을 들었다면 이 자선학점을 교양으로 신청하여 이 과목을 재수강할때 다른 교양과목으로 재수강이 가능한 것 입니까?교양으로 인정된다면 재수강 규정도 교양과목 내 어떤 교양과목으로라도 재수강이 가능한 것인가요?항상 감사합니다.",8,안녕하십니까 조교 이번 학기 교양 수지침 변경 관련 자선 과목 학점 교양 학점 인정 수강 편람 여기 이 교양 학점 인정이 무엇 예 제 경영학 전공 자선 프랑스어 수업 이 자선 학점 교양 신청 이 과목 재수 때 다른 교양과목 재수강 것 입 교양 인정 재수강 규정 교양과목 내 교양과목 재수강 것 항상
1340,안녕하세요 조교님장바구니에 신청 인원/제한 인원이 표시되어있는 칸에 계속 0/0이라고 떠있는데 이런 과목은 다음주 수강신청 기간에 신청을 못 하는 건가요?,5,조교 장바구니 신청 인원 제한 인원 표시 칸 계속 과목 다음주 수강신청 기간 신청 못 건가
1341,조교님! 교양 과목 수강 신청할때 처음엔 재수강 칸에 체크 안하고 그냥 신청했다가개강 후에 재수강 연결기간에 연결해도 똑같이 재수강 처리 되는거 맞나요?아니면 수강신청 할때부터 이 교양과목으로 재수강 할지 말지를 정해서 해야 하나요?항상 감사합니다!,6,조교 교양 과목 수강 신청 때 처음 재수강 칸 체크 안 그냥 신청 개강 후 재수강 결기 재수강 처리 수강신청 때 이 교양과목 재수강 정해 하나요 항상
1342,안녕하세요 조교님 날씨도 더운데 항상 수고하십니다 이중전공 및 부전공과 관련해서 질문이 있는데작년 이중 신청때 a 전공을 신청했다가 떨어지고 해당 전공으로 부전공 신청을 했습니다그리고 이번 부전공 변경때 a->b 로 부전공 변경을 했는데 이 상태에서 다시 2학기 이중 변경때 a로 변경 신청을 할 수 있나요? 만약 2학기 변경때 또 떨어지더라도 부전공 신청은 제한이 없으니 b에서 a로 변경 가능한거겠죠?,2,조교 날씨 항상 수고 이중 전공 및 부전 공과 관련 질문 작년 이중 신청 때 전공 신청 해당 전공 부 전공 신청 이번 부 전공 변경 때 로 부 전공 변경 이 상태 다시 학기 이중 변경 때 로 변경 신청 수 만약 학기 변경 때 또 부 전공 신청 제한 로 변경
1343,국내대학학점 교류시에는 대상대학 이름이 성적표나 성적증명서 같은 기타서류에 표기되나요?,0,국내 대학 학점 교류 시 대상 대학 이름 성적표 성적 증명서 서류 표기
1344,조교님!단일전공은 따로 신청하는 사항이나 절차가없는건가요?,5,조교 전공 신청 사항 절차 가요
1345,안녕하세요 조교님혹시 교양 재수강을 다른 수업으로 할 때재수강 체크하고 나중에 연결하라는데나중에 연결하는 방법이 무엇인가요??,6,조교 혹시 교양 재수강 다른 수업 때 재수강 체크 나중 나중 방법 무엇
1346,조교님 늘 고생이 많으십니다!하반기에 추가학기를 듣는 학생인데 4~6학점을 계획 중입니다. 근데 학점 수에 따라 등록금을 납부하는 걸로 알고있는데 수강신청기간에 6학점 넘게 신청해뒀다가 개강하고 정정기간에 드랍하는게 가능한가요? 강사법때문에 교수님도 확정 안 된 수업이 있어서 걱정이네요..,8,조교 늘 고생 하반기 추가 학기 학생 학점 계획 중 학점 수 등록금 납부 걸 수강신청 기간 학점 신청 개강 정정 기간 드랍 강사 법 때문 교수 확정 안 수업 걱정 요
1347,조교님 안녕하세요이번 부전공 신청기간을 놓쳤습니다이제 7학기째 들어야 하는데요혹시 2학기 끝나고 또 부전공신청기간이 있는지 궁금합니다추가로 부전공 이수학점은 모두 채웠는데 부전공은 이중전공 하던거랑 꼭 같은걸로 해야되나요? 아니면 타캠 혹은 타과로 신청가능한지도 알려주시면 감사하겠습니다,5,조교 이번 부 전공 신청 기간 이제 학기 혹시 학기 또 부전 신청 기간 추가 부 전공 학점 모두 부 전공 이중 전공 꼭 걸 캠 과로 신청
1348,조교님 안녕하세요!! 더운날씨에 정말 고생많으십니다?? 다름이 아니라 군휴학과 등록휴학에 대해 질문 드립니다!! 제가 2학기에 군대를 갈 예정이라 군휴학을 신청할 예정인데 다른 등록휴학과 동일하게 수강신청후 등록금을 납부하고 군휴학을 신청하면 등록휴학이 되는 건가요??아니면 일반휴학 신청이후에 군휴학으로 또 재신청 해야 하는 건가요??항상 많은 정보 주셔서 감사합니다 조교님??,9,조교 날씨 정말 고생 군 휴학 등록 휴학 대해 질문 제 학기 군대 예정 군 휴학 신청 예정 다른 등록 휴학 수강신청 후 등록금 납부 군 휴학 신청 등록 휴학 건가 일반 휴학 신청 이후 군 휴학 또 재 신청 건가 항상 정보 조교
1349,안녕하세요 조교님!저는 이번학기에 3학년으로 편입한 학생입니다6월달 이중전공신청때 a를 신청하고 이번7월에 다른과인 b를 이중전공으로 신청했습니다저는 b를 이중전공으로 신청하고 싶은데 이번년도 11월에 b라는 과를 이중전공 신청하면 되나요??,5,조교 저 이번 학기 학년 편입 학생 이중 전공 신청 때 를 신청 이번 과인 를 이중 전공 신청 저 를 이중 전공 신청 이번 년도 이중 전공 신청
1350,"조교님 안녕하세요13학번 통대생입니다.제가 교양24학점, 실외 7학점을 취득했는데졸업요건은 교양 26이더라구요해서 이미 교양은 요건을 충족한건지 2학점을 더 들어야하는지 알고싶습니다실외: (실용외국어1(2학점)+훕스 서바이벌 잉글리시2(2학점)+교양외국어(3학점)",8,조교 학번 통 생 제 교양 학점 실외 학점 취득 졸업 요건 교양 교양 요건 충족 학점 더 실외 실용 외국어 학점 훕스 서바이벌 잉글리시 학점 교양 외국어 학점
1351,안녕하세요 에타조교님 학교 홈페이지의 2019년 2학기 수강편람을 들어가서 학과 간 전공교류에서 전공교류(인정) 교과목 현황 참조 (클릭) 이라고 되어있는 부분을 아무리 죽을 때까지 눌러도 링크로 연결이 안되더라고요 대체 전공교류 교과목은 어떻게 하면 볼 수 있는 걸까요?참고로 아시아언어문화 대학 학생입니다. 제 컴퓨터가 먹통인가싶어 다른 컴퓨터로 봤는데도 클릭해도 아무 것도 안뜨네요 핸드폰으로 해도 안되고요.아시아언어문화대학 전공 교류 교과목 좀 알 수 있는 방법이 없을까요?,0,에타 조교 학교 홈페이지 학기 수강 편람 학과 간 교류 전공 교류 인정 교과목 현황 참조 클릭 부분 죽 때 링크 연결 대체 전공 교류 교과목 볼 수 요 참고 아시아 언어 문화 대학 학생 제 컴퓨터 먹통 다른 컴퓨터 클릭 아무 것 핸드폰 해도 아시아 언어 문화 대학 전공 교류 교과목 좀 알 수 방법
1352,안녕하세요 이중전공생도 과에서 장학금받을수있나요? 과사가 전화를 안받네요,0,중전 공생 과 장학금 과 사가 전화
1353,"도와주세요 조교님!!ㅠㅜ저는 영어통번역학부를 이중전공 중인데, 이번에 영통부 안에서 다른 세부전공으로 이중전공을 변경했어요. 그랬더니 2019년 1학기 이전에 들은 영통수업들이 모두 자선으로 분류되었어요.. 분명 이중변경 전에 영통과사에 전화했을 때에는 그대로 이중학점으로 인정된다고 들었는데 왜 자선으로 처리되었나요..ㅠㅜ 이중으로 못 돌리나요??",2,조교 저 영어 통 번역학 이중 전공 중 이번 영통 부 안 다른 세부 전공 이중 전공 변경 학기 이전 영통 수업 모두 자선 분류 분명 이중 변경 전 통과 사 때 그대로 이중 학점 인정 왜 자선 처리 이중 못
1354,안녕하세요 에타 조교님! 처음 글써보는데 신기하네요..ㅎㅎ저는 1학년에 재학중이고 이번 2학기 때 성적우수장학금 ‘학장’을 수혜할 수 있게 되었는데요. 이 경우에 학과장실 조교 근무 즉 2학기 공로장학금은 신청하지 못하는 건가요?! 아예 중복 수혜가 불가한건지 합쳐서 수혜범위 한도초과만 하지 않으면 할 수 있는 건지 궁금해서 이렇게 질문드립니다 !,3,에타 조교 처음 글 저 학년 재학 이번 학기 때 성적 우수 장학금 학장 수혜 수 이 경우 학과 실 조교 근무 즉 학기 공로 장학금 신청 건가 아예 중복 수혜 수혜 범위 한도 초과 수 질문
1355,안녕하세요!막학기인 학생입니다. 제가 자선2학점이 남았는데 전공과목으로 자선을 인정받을 수도 있나요?전공은 이미 52학점 채운 상태 입니다ㅠ,8,막 학기 학생 제 자선 학점 과목 자선 수도 전공 학점 채운 상태
1356,조교님 안녕하세요! 교환학생으로 최소12학점 이수해야 국장 신청 가능하구 이전 학점으로 들어가는거 맞나요? 교환가서는 자선으로 인정 받을려고 생각하고 있어요,8,조교 교환학생 최소 학점 이수 국장 신청 이전 학점 교환 자선 인정 생각
1357,"조교님 더운 여룸 항상 고생 하십니다다름이 아니라 이중전공과 자선에 대해 궁금한 게 있습니다.제가 이중전공으로 문화콘텐츠학을 선택하여 9학점을 이수 했습니다. 그러다 이번 학기에 경영학과로 이중전공을 변경했습니다.문화콘텐츠 수업 9학점이 자선으로 넘어간다는 걸 알고 있는데 이번 변경된 바에 따르면 9학점 자선을 교양으로 변경 가능하다고 들었습니다.그럼 이 9학점 중 재수강 가능 항목에 들어가는 수업을 다른 일반 교양(문화와 예술, 사철..등등)수업으로 재수강 할 수 있는지 질문드립니다.",8,조교 여룸 항상 고생 중전 공과 자선 대해 게 제 이중 전공 문화 콘텐츠 학 선택 학점 이수 이번 학기 경영학 과로 이중 전공 변경 문화 콘텐츠 수업 학점 자선 걸 알 이번 변경 바 학점 자선 교양 변경 이 학점 중 재수강 가능 항목 수업 다른 일반 교양 문화 예술 사철 등등 수업 재수강 수 질문
