,내용,분류,명사토큰
2046,안녕하세요~ 16학번으로 프랑스어학부에 입학하고2학년 돼서 이중전공은 영어학과로 신청하고 영어학과 수업을 들었었는데요 3학년 들어선 프랑스어학부 전공심화도 무조건 신청해야하는 건줄 알고 신청하고 FATI 전공에 들어가게 되었었는데.. 지금 수강 편람보니까전공심화 + 이중전공은 아예 란이 없더라고요ㅠㅠ그래서 그런지 수강신청 끝나고 종정시 들어가 보니까 제 전공에 1전공 프랑스어학부랑 이중전공 영어학 만 나와요.. 그런데 수강 신청할 때에는 FATI학부 수업들 신청이 됐었거든요.. 너무 어려워보여서 신청 안 했지만 저는 그럼 전공이 각각 어떻게 된건가요??그리고 이중전공->부전공으로 격하하거나전공심화만 듣는 건 언제 신청가능한가요?? <<요거 꼭 답변해주시면 감사하겠습니다ㅠㅠ,2,학번 프랑스어 학부 입학 학년 이중 전공 영어 학과 신청 영어 학과 수업 학년 프랑스어 학부 심화 무조건 신청 건줄 알 신청 전공 지금 수강 편 람보 전공 심화 이중 전공 아예 란 수강신청 종 정시 보 제 전공 전공 프랑스어 학부 이중 전공 어학 만 수강 신청 때 학부 수업 신청 보 신청 안 저 전공 각각 가요 이중 전공 부 전공 격 하하 거나 전공 심화 건 언제 신청 거 꼭 답변
2047,"안녕하세요! 다름이 아니라 학점 이월에 대해 여쭤보려고 합니다~ 이번 2-1학기에 21학점 수강 가능한지 궁금합니다. 1-1, 1-2 학기 둘 다 18학점씩 수강했은데 혹시 학점 이월제도가 있나요? 21학점 들을 수 있는건가요?",8,학점 이월 대해 이번 학기 학점 수강 학기 둘 학점 수강 혹시 학점 이월 제도 학점 수 가요
2048,"조교님 수고하십니다14학번이구 교양외국어를 1학기만 들었습니다.플렉스로 대체하려하는데 플렉스는(1,2학기 듣는 걸 대체하니까 4학점을 얻는건가요?)그",1,조교 수고 학번 이구 교양 외국어 학기 플렉스 대체 플렉스 학기 걸 대체 학점 가요 그
2049,"조교님 안녕하세요! :)사람들마다 너무 이야기가 달라서 이렇게 여쭤봅니다ㅠㅠ이번 1학기가 막학기라면, 1학기에 수업을 듣고 졸업학점을 충족한다면, 여름계절학기를 못듣는다고 하는데 맞나요?만약 그렇다면, 여름계절을 듣고 싶다면 졸업학점을 충족하지 않으면 되는거죠?예를 들어, 제가 15학점이 남았으면1학기에 14학점만 듣고, 여름계절에 졸업에 필요한 수업 1개+재수강2개, 이런식으로 들을 수 있는거 맞죠?ㅠㅠ",1,조교 사람 이야기 달라 이번 학기 막 학기 라면 학기 수업 졸업 학점 충족 여름 계절 학기 만약 여름 계절 졸업 학점 충족 예 제 학점 학기 학점 여름 계절 졸업 수업 개 재수강 개 식 수
2050,"Q1. ICT인턴 합격해서 ICT학점이수인턴1,2 (12학점) 수강신청한사람이 다른 강의(온라인강의)도 같은학기에 수강신청 할수있나요?Q2. 글쓰기 대체로 미네르바인문강좌2를 수강했는데 미네르바인문강좌1을 교양학점 채우는 용도로 초수강하거나 다른 교양의 재수강의 목적으로 미네르바인문강좌1을 재수강연결로 들을수있는가?",8,인턴 합격 학점 인턴 학점 수강신청 사람 다른 강의 온라인 강의 도 학기 수강신청 글쓰기 대체로 미네르바 문강 좌 를 수강 미네르바 문강 좌 교양 학점 용도 초 수강 거나 다른 교양 재수강 목적 미네르바 문강 좌 재수강 연결
2051,조교님감사해요,3,조교
2052,조교님 8학기에 과에서 수석 또는 차석을 했는데 9학기를 다니게되면 9학기에 성적 장학금이 나오나요?,1,조교 학기 과 수석 차석 학기 학기 성적 장학금
2053,조교님 안녕하세요. 교무처장실 학사조교 근무기간이 개강 후부터 방학기간까로 나와있는데 혹시 방학에 부득이한 사정이 있어서 근무가 어렵다면 조교자리 양도가 불가능할까요?,3,조교 교무 처 실 학사 조교 무기 개강 후 방학기 혹시 방학 부득이 사정 근무 조교 양도 요
2054,안녕하십니까 조교님. 4학년인데 3학년 전필을 신청못했는데 정정기간에 만약에 교수님이 안열여주신다고하면 어떡하죠? 졸업반인데 재수강이 아니라 초수강이라 꼭 들어야하는 상황입니다. 한번 증원해주시긴하셨는데 만약에라도 안된다고하시면 방법이 없나요? ㅠㅠ 신경쓰여서 속이 뒤집어질거같습니다.....,0,안녕하십니까 조교 학년 학년 필 신청 정정 기간 만약 교수 졸업 반 재수강 초 수강 꼭 상황 한번 증원 만약 방법 신경
2055,19학년도 1학기 19학점 신청 했어요올해 2학기로 1학점 이월 신청하고 싶은데 언제 어떻게 해야 할까요?,1,학년 학기 학점 신청 올해 학기 학점 이월 신청 언제 요
2056,제가 원래 이번학기가 8학기인데 시험도 아직이고 학점도 다 못채워서 한학기 더다닐거 같아요. 그런데 이번에 이중전공을 부전공으로 못 내렸어요.. 추가학기인 다음 학기에도 내릴수 있나요??ㅜㅜ,1,제 원래 이번 학기 학기 시험 학점 학기 더 이번 이중 전공 부 전공 못 추가 학기 다음 학기
2057,"조교님 전공심화신청은 언제 어디서 하는건가요ㅠㅠ수강편람읽어도 안보여요,,,, 이번학기는 끝났다는데 맞나요?ㅠ",3,조교 심화 신청 언제 가요 수강 편람 안보 여요 이번 학기
2058,"안녕하세요 조교님!저는 현재 익씨를 이중전공으로 하고 있는데요!11학점까지 영어대 내 전공교류가 가능하다고 해서 3학점 4게목, 총 12학점을 수강신청했습니다!근데 한 과목이 자선으로 뜨는데 혹시 3학점이 다 자선으로 넘어가는 건가요?? 아님 1학점만 넘어가게 되나요??",8,조교 저 현재 익 이중 전공 학점 영어 내 교류 학점 게목 총 학점 수강신청 과목 자선 혹시 학점 자선 건가 학점
2059,조교님 안녕하세요. 전공 초과학점 관련해서 문의드려요. 지금 전공을 52학점 이수했고 2학점이 남아있는데 이번에 전공3학점짜리를 신청하면 55학점 초과되어서 수업하나가 자선으로 빠지게 될거 같은데요.. 그럼 2학점짜리 수업이 자선으로 빠져도 53학점이 되는거고 이번에 듣는 3학점짜리가 ㅈㅏ선으로 빠지면 52학점 그대로라 졸업을 못하게 되는건가요...,8,조교 전공 초과 학점 관련 문의 지금 전공 학점 이수 학점 이번 전공 학점 리 신청 학점 초과 수업 하나 자선 학점 수업 자선 학점 이번 학점 리가 선 학점 그대로 졸업 가요
2060,안녕하세요. 부전공 학점이 자선 학점으로 바꼈는데 학종지 가면 다시 바꿔주나요??,8,부 전공 학점 자선 학점 바 학 종지 가면 다시
2061,조교님 질문이 있어 올립니다! 교양별 취득현황가보면 32학점 필수이수이고 14 12 6 이렇게 들으라고나와있잖아요 그런데 저는 14 14 4 로 나와있는데 핵심교양부분 14에서 2학점 초과된건 졸업할때 자동으로 자유교양으로 넘어가서 14 12 6으로 바뀌는 건가요?!! 아시는분들 답해주세요 ㅠㅜ감사합니다,8,조교 질문 교양 별 취득 현황 학점 필수 이수 저 로 핵심 교양 부분 학점 초과 졸업 때 자동 자유 교양 건가 아시 분 답
2062,산공+컴공 이중전공 중인 학생인데요 이번에 공과대학에 개설되어있는 컴공과목 하나 수강신청했는데 수강신청 화면에서 1전공으로 들어가지더라고요ㅠㅠ 이거 이중 학점으로 인정 되려나요..,2,산공 컴공 이중 전공 중인 학생 요 이번 공과대학 개설 컴공 과목 하나 수강신청 수강신청 화면 전공 거 이중 학점 인정 요
2063,조교님! 늘 수고많으십니다ㅠ 다름이 아니라 대학외국어 과목도(교양영어가 아닌 과목이요) 교수님께 허가를 받으면 증원이 가능할까요? 그렇다면 혹시 절차가 어떻게 될까요?ㅠ,4,조교 늘 수고 대학 외국어 과목 교양 영어 과목 교수 허가 증원 요 혹시 절차 요
2064,수고 많으십니다.수강신청 때 비고란의 1전공 수강금지라고 적힌 이중전공이 수강신청이 되면서 구분에 1전공으로 바뀌는데 (해당과목의 1전공입니다.)실제로는 수강신청 불가능한 건가요?감사합니다.,2,수고 수강신청 때 비고 란 전공 수강 금지 이중 전공 수강신청 구분 전공 해당 과목 전공 실제 수강신청 건가
2065,휴학은 수강신청이랑 다르게오늘 오후 11시 59분까지 종합정보시스템에서 신청하면 되나요?,9,휴학 수강신청 오늘 오후 종합정보시스템 신청
2066,"안녕하세요, 조교님. 몇가지 궁금한게 있어 글을 남깁니다.1. 추가학기생 등록기간, 방법 및 이수학점에 따른 등록금 납부비율이 어떻게 되나요?2. 교양학점에 실용외국어 영역도 포함되는 것이 맞나요?이걸 예전 학교 홈페이지에서 봤던 기억이 나는데 지금 찾을수가 없네요... ㅠ 그래서 부득이하게 질문드립니다!",8,조교 가지 글 추가 학기 생 등록 기간 방법 및 학점 등록금 납부 비율 교양 학점 실용 외국어 영역 포함 것 걸 예전 학교 홈페이지 기억 지금 부득이 질문
2067,안녕하세요 조교님!글캠생입니다. 특별실용강좌를 교양과목 재수강으로 연결가능한가요?,6,조교 글캠생 특별 실용 강좌 교양과목 재수강 연결
2068,조교님!! 개강 후 휴학처리가 가능한가요? 3주 내에 휴학신청하면 등록금 전액 환불 되는건가요?,9,조교 개강 후 휴학 처리 주 내 휴학 청하면 등록금 전액 환불 가요
2069,안녕하세요 조교님! 재수강 관련해서 여쭤보고싶은 점이 있어 글 남깁니다!1. 재수강 하기 전 과목의 이수학점이 증발하는거로 알고있는데만약 재수강으로 인해서 그 학기의 총 이수학점이 18학점 미만으로 떨어진 경우조기졸업 신청조건중 학기당 최소 18학점에 조건 미달이 되는건가요??2. 만약 계절학기로 재수강하는 경우 계절학기 성적은 조기졸업 조건에 반영하지 않나요?,1,조교 재수강 관련 점 글 재수강 전 과목 학점 증발 만약 재수강 그 학기 총 학점 학점 미만 경우 조기졸업 신청 조건 학기 최소 학점 조건 미달 가요 만약 계절 학기 재수강 경우 계절 학기 성적 조기졸업 조건 반영
2070,안녕하세요 조교님 고생 많으십니다. 다름이 아니라 이번학기에 기존 전공수업하나가 사라지고 완전히 다른 새로운 수업하나가 개설되었습니다. 그런데 제가 없어진 수업 재수강을 하고 싶은데 어떻게 연결을 해야할지 막막합니다. 편람에는 연결기간에 종합정보시스템에서 연결할수 있다는데 전공수업도 그렇게 가능한가요?몇몇조교분은 학과장 승인을 받아서 학종지에서 처리를 해야한다고 하시는데 어느게 맞는건가요? ㅠㅠ,3,조교 고생 이번 학기 기존 수업 하나 다른 수업 하나 개설 제 수업 재수강 연결 편람 결기 종합정보시스템 수업 조교 학과 승인 학 종지 처리 게 가요
2071,"안녕하세요! 수강편람에서 타 대학과 제 이중전공이 전공교류가 가능한 것을 확인하고, 그 과목이 제 학년에 맞는 과목이어서 수강신청을 했는데 과목별 수강신청 제한학과 라는 알림이 뜨고 수강신청이 안 되더라구요ㅜㅠ 내일 수강신청 하면 되는 걸까요??? 아니면 어디에 전화해봐야 할까요,,?",4,수강 편람 타 대학 제 이중 전공 교류 것 확인 그 과목 제 학년 과목 수강신청 과목 별 수강신청 제한 학과 알림 수강신청 안 내일 수강신청 요 어디 전화 요
2072,조교님 안녕하세요     다름이아니고    제가 이번에 평소 배워보고싶은  외국어를 (대학외국어1)  수강신청했습니다   근데 알고보니 이게 교양외국어  필수라고되있던데  저는  지금  자선만 채우면되거든요        그러면 수업들을 자격이없는건가요??     아니면 상관없나요??,0,조교 제 이번 평소 외국어 대학 외국어 수강신청 알 이 교양 외국어 필수 저 지금 자선 수업 자격 가요
2073,14학번은 바이오메디컬공학부 부전공 못하나요?수강편람에 명시된바는 없는데 다들 그렇게 알려줘서요,0,학번 바이오 컬 학부 부 전공 못 하나요 수강 편람 명시 바
2074,"만약 졸업까지 채워야할 전공학점이 10이고 채워야할 자선이 5라고 했을 때, 전공을 3학점짜리 수업 4개를 들어서 전공학점이 12가 된다면, 3학점짜리 수업 하나를 찢어서 1은 전공으로,2는 자선으로 되는건가요, 아니면 수업 하나는 안찢어지고 그냥 전공학점 초과고 자선은 그대로로 되는건가요?",8,만약 졸업 학점 자선 때 전공 학점 수업 개 학점 학점 수업 하나 은 전공 자선 가요 수업 하나 그냥 전공 학점 초과 자선 그대로 가요
2075,어학연수를 다녀오면 학점인정 받을수 있나요 ? 그렇다는 얘기를 들어서 만약 그렇다면 그 사항에 대한 안내는 어디서 알아볼수 있나요 ㅠㅠ?,8,어학 연수 학점 인정 얘기 만약 그 사항 대한 안내
2076,교양 중에 문화와 예술 카테고리에 있던 과목 재수강으로 삶과지혜의 카테고리 교양과목으로 바꿔 해도 되나요?ㅠ,6,교양 중 문화 예술 카테고리 과목 재수강 삶 지혜 카테고리 교양과목 해도
2077,조교님 바쁘시겠지만 수강편람을 정독해도 안나와있어 문의드려요ㅠㅠ교양영어 14학번 이전 수강 가능이라고 비고에 적혀있는데 14학번이전만 수강가능한건지 14학번이전도 수강가능하고 다른학번도 가능한건지 궁금해요ㅠㅡㅠ 14학번이전 아닌데 장바구니에 담는거랑 신청버튼이 눌리더라구요ㅠㅠ,0,조교 수강 편람 정독 문의 교양 영어 학번 이전 수강 가능 비고 학번 이전 수강 학번 전도 수강 학번 학번 이전 장바구니 신청 버튼 눌리
2078,안녕하세요 조교님!! 저 화학 이중전공 학생인데 2학년 화학 강의 비고란에 이중 이런 표시도 없고 전공수업만 뜨더라구요..이중이여도 그냥 전공 수업 신청해서 들으면 되나요??,2,조교 저 화학 이중 전공 학생 학년 화학 강의 비고 란 이중 표시 수업 이중 도 그냥 전공 수업 신청
2079,"안녕하세요 조교님! 수강신청때 놓친 과목을 군휴학한 동기의 아이디를 빌려 잡게되었는데, 그 친구 아이디로 잡은 과목은 금요일 전학년 수강신청기간 이후에는 다 날아가나요? 항상 감사합니다??",4,조교 수강신청 때 과목 군 휴학 동기 아이디 그 친구 아이디 과목 금요일 학년 수강신청 기간 이후 항상
2080,"안녕하세요 조교님,글로벌캠퍼스학생입니다교양과목 재수강을 실용외국어과목으로도 연결가능한가요?",6,조교 글로벌 캠퍼스 학생 교양과목 재수강 실용 외국어 과목 연결
2081,조교님 안녕하세요! 전공 과사에서 들은 이야기인데 정확히 이해를 못해서 물어봐요! 전공 수강신청하고 중원이 폐강 강의를 가려내기 위해서 금요일까지 10명 정원으로 열리고 폐강이 안된다면 신청을 할 수 있다는데 정정기간에 신청이 가능한거겠죠??,5,조교 전공 과사 이야기 이해 전공 수강신청 중원 폐강 강의 위해 금요일 명 정원 폐강 신청 수 정정 기간 신청
2082,안녕하세요. 조교님 14학번 재학생입니다. 졸업을 위해서 토익 등 어학성적을 제출해야되는 것으로 알고 있는데 (실용외국어 안들음)기준에 부합하는 어학성적을 제출하면 실용외국어 4학점 이수한 것으로 총이수학점에 반영이 되나요 ?,7,조교 학번 재학생 졸업 위해 토익 등 어학 성적 제출 것 알 실용 외국어 기준 부합 어학 성적 제출 실용 외국어 학점 이수 것 학점 반영
2083,"안녕하세요 조교님! 다른분들의 도움을 받아 1전공,이중전공의 학사학위명을 검색해봤는데 찾지 못했습니다ㅠㅠ방학이라 학종지랑 과사들도 모두 전화를 받지않구요..혹시 어디서 학사학위명을 알아볼 수 있는지 아시나요???",2,조교 다른 도움 전공 이중 전공 학사 학위 검색 방학 학 종지 과사 모두 전화 혹시 학사 학위 수
2084,안녕하세요! 1전공 개설 과목이 이중전공(융합전공) 연계 과목이랑 동일한데이 경우에 1전공꺼 신청하고 나중에 학종지가서 이중전공으로 변경 가능한가요?  요약1전공이 이중이랑 동일할 경우에 1전공을 학종지에서 이수구분변경(이중)으로 가능한가요?,2,전공 개설 과목 이중 전공 융합 전공 계 과목 경우 전공 신청 나중 학 종지 이중 전공 변경 요약 전공 이중 경우 전공 학 종지 구분 변경 이중
2085,저는 특수어 전공에 경영 부전하고 있습니다.이번에 경제학원론을 자선으로 수강하려 장바구니 담고 수강신청도 하려합니다.그런데저번주 장바구니만 하더라도 경제학원론과목이 담기가능했는데갑자기 수강제한학과라고 뜨네요...ㅜㅅㅜ 왜그럴까요...ㅜㅜㅠ 비고란에는 1전공자 수강불가인데...,4,저 특수 전공 경영 부전 이번 경제학 원론 자선 수강 장바구니 수강신청 저번 주 장바구니 경제학 원론 과목 갑자기 강제 학과 왜 요 비고 란 전공자 수강 불가
2086,조교님 안녕하세요?혹시 교양 과목 2학점짜리를 교양 3학점짜리로재수강 가능한가요?계솓 찾아봐도 수강편람에 안써져 있어서요ㅠㅠ,8,조교 혹시 교양 과목 학점 리 교양 학점 리 재수강 계솓 수강 편람
2087,안녕하세요 조교님! 수고 많으십니다~!전필 관련해서 문의 드립니다.15학번 이후- 이런 식으로 써있는 게 아니고15년 지정 - 이렇게 써있으면15학번 윗학번들에게까지 해당된다는 말인가요?,3,조교 수고 필 관련 문의 학번 이후 식 게 지정 학번 학번 해당 말
2088,조교님 안녕하세요!전공심화 안 하고 부전공만 할 계획인데 그럼 전공 54 부전공 21 교양 32 이렇게 들으면 졸업학점까지 많이 남는데 나머지 약 30학점은 자선으로 채우는 건가요?,2,조교 전공 심화 안 부 전공 계획 전공 부 전공 교양 졸업 학점 나머지 약 학점 자선 건가
2089,조교님 안녕하세요!전공교류 인정은 이중전공도 되는 건가요?이중전공이 문화콘텐츠학과인데 방송영상뉴미디어 전공에서 문화콘텐츠학 융합전공 인정되는 수업을 듣고싶어서요!,2,조교 전공 교류 인정 이중 전공 건가 이중 전공 문화 콘텐츠 학과 방송 영상 뉴미디어 전공 문화 콘텐츠 학 융합 전공 인정 수업
2090,"조교님 안녕하세요!현재 a학과 부전공을 하고있고 이중전공으로 돌릴생각인데요.1. 부전공에서 이중전공으로 돌릴때 그 이전까지의 모든 성적의 평균으로 반영되나요? 아니면 이중전공으로 돌리기 바로 전 두 학기의 성적만 반영되나요?(후자EX. 2019-2를 끝내고 바꾼다면 2019-1,2의 성적만 반영)2. 부전공에서 이중전공으로 돌리면 2전공으로 들었던 강의들을 따로 변경신청하지 않아도 되는거죠?",2,조교 현재 학과 부 전공 이중 전공 생각 요 부 전공 이중 전공 때 그 이전 모든 성적 평균 반영 이중 전공 바로 전 두 학기 성적 반영 후자 를 의 성적 반영 부 전공 이중 전공 전공 강의 변경 신청
2091,안녕하세요!혹시 이중전공을 바꿨다가 다시 또 바꾸는게 가능한가료? 원래 바꿨덩걸루요 예를들면문콘→경영→문콘이런식이요!,2,혹시 이중 전공 다시 또 가료 원래 바꿨덩걸루 를 콘 경영 콘 식이
2092,안녕하세요 조교님! 혹시 이번 학년도에 전공교류 가능한 과목을 알아보려면 작년 2학기 수강편람을 보면 되나요? 이번년도거에는 안보여서요ㅠㅍ,4,조교 혹시 이번 학년 도 전공 교류 과목 작년 학기 수강 편람 이번 년도 거
2093,"안녕하세요 조교님! 늘 친절한 답변과 유익한 정보 감사드립니다????교양 과목 질문이 하나 있습니다!삶과 지혜 과목(자선)에서 상대평가였던 과목 재수강을 하려는데, p/f 과목으로 재수강도 되나요~~?ex. 오페라의감상 -> 사회봉사 이렇게요! 사회봉사 수강신청 보면 재수강 선택은 되는데, p/f과목끼리 재수강인지 잘 모르겠어서 질문드립니다.감사합니다????????",4,조교 늘 답변 정보 감사 교양 과목 질문 하나 삶 지혜 과목 자선 상대평가 과목 재수강 과목 재수강 오페라 감상 사회 봉사 사회 봉사 수강신청 재수강 선택 과목 끼리 재수강 질문
2094,조교님 안녕하세요! 혹시 이중 신청을 2-2 끝나고도 할 수 있나요?,5,조교 혹시 이중 신청 수
2095,안녕하세요 조교님졸업 논문 꼭 4-2에만 써야하나요?4-1에 써도 되나요?,7,조교 졸업 논문 꼭
2096,인녕하세요 조교님! 제가 진로설계 세미나를 한번 들었었는데 훕커도 들어야 하는건가요??,3,인녕 조교 제 진로 설계 세미나 한번 훕커 가요
2097,안녕하세요 조교님!예전에 들었던 강의를 재수강하고 싶은데 해당 강의가 폐지되면 해당 강의 분류에서 다른 강의를 선택하여 종합정보시스템에서 재수강 연결하면 되는건가요?,6,조교 예전 강의 재수강 해당 강의 폐지 해당 강의 분류 다른 강의 선택 종합정보시스템 재수강 가요
2098,안녕하세요 조교님!제 전공이 A과인데 B학과의 수업과 전공교류가 가능하여 들으려고하는데요!혹시 B학과 수업 중 이중(부)로 개설된 수업도 전공교류로 A과에서 인정이 가능한가요?ㅎㅎ,0,조교 제 전공 과 학과 수업 교류 혹시 학과 수업 중 이중 부 로 개설 수업 교류 과 인정이
2099,안녕하세요!혹시 부전공을 2개하는것도 가능한가요?,2,혹시 부 전공 개
2100,안녕하세요!!제가 이중을 못해서 마리 수업을 들으려고 하는데 이중전공끼리도 전공 교류가 되나요?ㅠㅠ경영 이중하려고 미리 수업 하나를 들어놓고 싶은데 자선으로 전공교류되는 경제 수업을 듣고 나중에 경영 이중 됐을때 그 과목을 이중전공 교류로 인정할수 있나요? 그러면 경제를 이중전용 수업을 들어야 겠죠?그리고 재수강을 하려면 1학기떼들은건 꼭 1학기에 다시들어야하나요? 그리고 과목명이 같으면 교수님아 달라도 상관없는거죠?ㅠㅠ 질문이 넘 많아서 죄송합니다????,2,제 이중 마리 수업 이중 전공 끼리 전공 교류 경영 이중 미리 수업 하나 자선 교류 경제 수업 나중 경영 이중 때 그 과목 이중 전공 교류 인정 경제 이중 전용 수업 재수강 학기 떼 건 꼭 학기 다시 과목 교수 달라 질문
2101,조교님 제가 예전에 수강 했던 수업이 언어와 문학 상대평가 수업이었는데 재수강 하려고 보니까 생활과운동 패논패 수업으로 바뀌었습니다. 이런 경우에도 재수강 연결이 가능한가요?,6,조교 제 예전 수강 수업 언어 문학 상대평가 수업 재수강 보 생활 운동 패논패 수업 경우 재수강 연결
2102,안녕하세요 조교님이번에 막학기다니는 4학년입니다. 자선6중에 2만채워서 4를더채워야하는 상황인데 만약 3학점짜리교양과 2학점짜리수업을들으면 자선이 7학점이되는건가요? 아니면 자선은 6까지만 채울수있나요?,8,조교 이번 막 학기 학년 자선 중 를더 상황 만약 학점 교양 학점 수업 자선 학점 가요 자선
2103,안녕하세요 에타조교님 다름아니라 이중변경에관해 질문이있어서 글올립니다.이중전공 첫배정때 a전공을 했고 현재 너무안맞는거같아서 b전공 부전공으로 내렸습니다. 다음에 이중전공 변경할때 c전공으로 가능한가요???ㅠㅠㅠㅠ,2,에타 조교 이중 변경 관해 질문 글 이중 전공 배정 때 전공 현재 무안 전공 부 전공 다음 이중 전공 변경 때 전공
2104,"안녕하세요 조교님!!코트라 인턴쉽이나, 교환학생, 7+1 등을 위해 학점 제한이 있는지 궁금합니다!그리고 몇 학년 때 갈 수 있는지, 신청은 어떻게 하는지 궁금합니다!!",3,조교 코트라 인턴쉽 교환학생 등 위해 학점 제한 몇 학년 때 수 신청
2105,안녕하세요 진로취업센터 비밀번호가 자꾸 오류가 나는데 어떻게 해야할까요? 학교홈페이지는 로그인이 잘됩니다ㅠㅠ,0,진로 취업 센터 비밀번호 자꾸 오류 요 학교 홈페이지 로그인
