,내용,분류,명사토큰
630,안녕하세요 조교님.14학번 졸업요건 확인 차 질문드려요!현재 전필이수o 1전공 졸업시험o 부전o 교양o학종지 외국어인증 토익성적 제출o교양영어x인 상태인데요.2020-1학기를 9학기 등록 후 flex(영어) 성적 학교에 제출하면20년 8월 졸업 가능인지 묻고싶습니다!그리고 9학기에 p/f 과목 f 받아도 flex로 실외 대체하면 졸업에 무리 없는지두요..!참고로 1전공 경영 + 부전공 영어 입니다감사합니다!!,7,조교 학번 졸업 요건 확인 차 질문 현재 필 이수 전공 졸업 시험 부전 교양 학 종지 외국어 인증 토익 성적 제출 교양 영어 인 상태 요 학기 학기 등록 후 영어 성적 학교 제출 졸업 가능 학기 과목 로 실외 대체 졸업 무리 요 참고 전공 경영 부 전공 영어
631,조교님 안녕하세요!그 이번학기에 교차전공 인정이 가능하다고 한 타과 전공과목 하나가 지금 보니까 자선으로 되어있는 것을 발견했는데요....종정시에서 제가 따로 1전공으로 돌리거나 학교에 전화해서 처리가 가능할까요?혹은 학교로 직접 찾아가는수밖에는 없나요 ㅠㅠ?미리 답변 감사합니다!,2,조교 그 이번 학기 교차 전공 인정이 타 전공 과목 하나 지금 보 자선 것 발견 종 정시 제 전공 학교 처리 요 학교 직접 미리 답변
632,안녕하세요 조교님1학년1학기 마치고 휴학후 2020년1학기에 복학하면2학기가 되는데 이경우 이중전공은 어떻게될까요? 3학기에 신청하게되나요?,1,조교 학년 학기 마치 휴학 후 학기 복학 학기 이경우 이중 전공 요 학기 신청
633,안녕하세요 조교님지역전문가 취소 기간이 어떻게 되는 지 알 수 있을까요??,3,조교 지역 전문가 취소 기간 알 수
634,안녕하세요 조교님 전필을 안 들었다면 추가학기 때 계절학기를 신청할 수 있을까요? 감사합니다,1,조교 필 안 추가 학기 때 계절 학기 신청 수
635,조교님 9학기이상 들으면 재학증명서에 4학년으로 나오나요 5학년등으로 나오나요?,1,조교 학기 이상 재학 증명서 학년 학년 등
636,"조교님20년 1월 초부터 인턴을 하게 되었는데요, 막학기라 계절을 동시에 들어야하는 상황입니다.근데 인턴과 계절이 겹치는 기간이 있어서 취업계를 제출하려고 하는데1. 계절 취업계 가능 여부는 교수님께 달려 있겠죠?2. 학교 제출용 취업계 양식 따로 있나요?",3,조교 초 인턴 막 학기 계절 동시 상황 인턴 계절 겹 기간 취업 제출 계절 취업 가능 여부 교수 학교 제출 용 취업 양식
637,조교님 제가 1ㅡ1학기를 마치고 지금 군복무를 수행중인데 학교에 복학하는대신 정부초청프로그램으로 1년동안 유학을 생각하고 있습니다. 그런데 이 프로그램을 하면 과에서 한학기 인정해준다고 들었는데(이 프로그램에서 수업글은 학점은 pass fail로 처리됩니다)  그러면 2학년때 칙플원이나 교환학생 선발자격이 학점 3.0이상인데1ㅡ1학기것이 1학년전체학점으로 반영되는지 궁금해서 이렇게 글 올립니다,1,조교 제 학기 마치 지금 군복무 수행 학교 복학 대신 정부 초청 프로그램 유학 생각 이 프로그램 과 학기 인정 이 프로그램 수업 글 학점 로 처리 학년 때 칙플원 교환학생 선발 자격 학점 이상 학기 것 학년 전체 학점 반영 글
638,안녕하세요 조교님!영어학과 편입생이고 이중전공 중인 학생입니다.제 경우는 FLEX가 필수 졸업인정조건이라고 하는데타과 기초 외국어강좌 이수로 대체가 가능할까요?,0,조교 영어 학과 편입 생 이중 전공 중인 학생 제 경우 필수 졸업 인정 조건 데타 기초 외국 어강 좌 이수 대체 요
639,안녕하세요 조교님이번 겨울 계절학기 성적이 2학기 성적으로 들어간다고 알고있는데학교 등록금 고지서 떼기전에 계절학기 성적이 2학기 성적으로 들어가서 합쳐졌을때 떼나요?,1,조교 이번 겨울 계절 학기 성적 학기 성적 학교 등록금 고지서 계절 학기 성적 학기 성적 때
640,안녕하세요 조교님!FLEX시험 점수로 교양 2학점 인정받는 것에 대해서요!제출을 꼭 종강일까지 해야 하나요?이번 학기가 막학기고 다음 학기는 졸업유예신청했는데요. 이미 성적표는 받아놓았는데 다음주에 가서 제출하면 이번 학기 성적으로 인정이 안 되나요?,1,조교 시험 점수 교양 학점 것 대해 서요 제출 꼭 종강 일 하나요 이번 학기 막 학기 다음 학기 졸업 유예 신청 성적표 다음주 제출 이번 학기 성적 인정이 안
641,안녕하세요 조교님전공필수를 듣지 않은 상태로 134학점 초과해서 추가학기 다닐 수 있을까요?? 제가 재수강 제한에 걸려서 더 이상 재수강은 불가한 대신에 총 이수학점을 늘려서 평점을 올리려고 합니다 아 추가적으로 부전공은 전공무관 졸업요건이없는 거 맞을까요?? 아니면 이부분도 과마다 상이한가요?? 감사합니다!,8,조교 필수 상태 학점 초과 추가 학기 수 제 재수강 제한 더 이상 재수강 대신 총 학점 평점 추가 부 전공 전공 무관 졸업 요건 거 부분 과 상이 가요
642,안녕하세요!휴학기간초과로 제적된뒤재입학하려고 합니다.신청 기간은 검색해보니 6월 24일부터라고나와있는데이 기간 안에만 신청이 가능한가요?,5,휴학 기간 초과 제적 뒤재 입학 려고 신청 기간 검색 기간 안 신청
643,"안녕하세요 조교님!항상 수고 많으십니다:)졸업관련 문의드립니다.현재 4-1학기까지 마쳤고 22학점이 남은 상황인데요! 4-2학기에 20학점을 수강하고 여름 계절학기에2학점을 수강하는 걸로 졸업이 가능할까요?여름계절학기로 졸업이 불가능할 경우, 추가학기를 등록해야하는건가요?감사합니다!",1,조교 항상 수고 졸업 관련 문의 현재 학기 학점 상황 요 학기 학점 수강 여름 계절 학기 학점 수강 걸 졸업 요 여름 계절 학기 졸업 경우 추가 학기 등록 가요
644,안녕하세요? 총 이수학점은 다 채웠는데 전필을 안 들었으면 수료되지 않나요? 추가학기 다니고 싶어서요.,1,총 학점 필 안 수료 추가 학기
645,조교님 제가 수강신청할 때 수강취소한 과목이 있었는데 수강취소된 것도 확인 다 했는데 이제 와서 보니까 취소가 안되있더라구요ㅜㅜㅜ제가 종정시로는 확인을 잘 안해서 제가 확인 안 한 탓이지만.. 수강신청 했던 기록이 남을 수 있을까요...? 과사무실에 가서 여쭤는 볼건데 만약 그 때 취소가 안됐던 거라면 이 과목 이제와서 수강 취소가 되는건 불가능 하겠죠..?,4,조교 제 수강신청 때 수강 취소 과목 수강 취소 것 확인 이제 보 취소 제 종 정시 확인 안해 제 확인 안 탓 수강신청 기록 남 수 과 사무실 만약 그 때 취소 거 라면 이 과목 이제 수강 취소 불가능
646,안녕하세요 이번 계절학기 수강에 관해서 질문이 있는데 서울캠에 개설된 사이버 강의와 글로벌캠에서 개설된 사이버 강의를 동시에 수강 신청해 놓은 상황입니다. 오늘 확인해 보니 시험 시간이 겹치는데 둘 중 한 과목을 취소 해야하는 건가요?,0,이번 계절 학기 수강 관해 질문 캠 개설 사이버 강의 글로벌 캠 개설 사이버 강의 동시 수강 신청 상황 오늘 확인 시험 시간 겹 둘 중 과목 취소 건가
647,"조교님 안녕하세요! 군휴학에 대해 모르는게 있어 여쭤보려고 합니다. 내년 1학기에 군대를 가려고 하는데, 그때 갈지 안갈지에 대해 약간 미정인 상태입니다. 그런데 갑자기 군대를 가게된다면 중간에 휴학신청이 가능한건가요? 학교 홈페이지에선 뭐라고 검색해야 알아볼수있나요?",9,조교 군 휴학 대해 내년 학기 군대 그때 대해 약간 미정 상태 갑자기 군대 가게 중간 휴학 신청 가요 학교 홈페이지 검색
648,"조교님 안녕하세요!다름이 아니라 이중전공 변경 대상자가 2-4학년인거면 4-1학기, 4-2학기에도 부전공을 이중전공으로 올릴 수 있다는 말인가요?수고스럽게 해드려서 죄송합니다ㅠ즐거운 연말 보내세요:)",2,조교 이중 전공 변경 대상자 학년 면 학기 학기 부 전공 이중 전공 수 말 수고 연말
649,조교님 안녕하세요 :)이번에 계절학기를 서울캠에서 듣게 되었는데 789교시이면 서울캠은 3시부터 수업이라는데 맞나요?.?,1,조교 이번 계절 학기 캠 교시 캠 수업 데
650,에타 조교님!자선 1학점이 부족해도 졸업 가능한가요?ㅠㅠ,8,에타 조교 자선 학점 졸업
651,안녕하세요! 에타 조교님!!2학기 휴학하고 내년 3월부터 복학을 하려고 하는데 복학 신청 기간이 언제인지 알 수 있을까요??,9,에타 조교 학기 휴학 내년 복학 복학 신청 기간 언제 알 수
652,조교님 현재 지비티학부 이중 중인데 제가 전에도 이중을 변경한거라 이번에 또 바꾸려면 부전공으로 내려야 한다고 들었어요 더불어 이중 학위를 받고 싶으면 추가학기를 다니면 된다고 안내받았는데 맞는지 여쭙고싶습니다그리고 재변경하려면 어떻게 해야하는건가요?부전공 신청 때 신청하면 될까요??,5,조교 현재 비티 학부 이중 중 제 전 이중 변경 거 이번 또 부 전공 이중 학위 추가 학기 재 변경 가요 부 전공 신청 때 신청 요
653,조교님 기말 성적조회 페이지에서 강의평가를 다른 과목과 착각해서 잘못 저장했습니다. 수정할 순 없나요? 열정적인 교수님이시라 부당한 평가를 받으시긴 너무한 처사라고 생각됩니다.ㅠㅠ,3,조교 말 성적조회 페이지 강의 평가 다른 과목 착각 잘못 저장 수정 순 열정 교수 시라 평가 처사 생각
654,안녕하세요 외타조교님 답변하느라 고생이 많으십니다지금 전공 졸업논문이 떨어진 상태고 이중전공도 점수미달인데 졸업유예 신청할 필요가 있나요?만약 있다면 어떻게 신청해야 되나요?,5,외 조교 답변 고생 지금 전공 졸업 논문 상태 이중 전공 점수 미달 졸업 유예 신청 필요 만약 신청
655,"안녕하세요이중전공 중인 한과목을 재수강하려고 하는데요그 전에 이중변경을 하려고 합니다!전공은 같은 과목으로만 재수강이 된다고 알고 있는데요 이중전공을 바꿔서 전공이 아니게 되면, 그 전공의 다른과목으로 재수강이 가능한가요?",2,이중 전공 중인 과목 재수강 전 이중 변경 전공 과목 재수강 알 이중 전공 전공 그 전공 과목 재수강
656,"조교님! 취업계 문의드려요!7학기에 취업이 되어서다음학기(8학기)에 취업계를 쓰고싶습니다전공학점 5부전공 학점 6 이 남았는데,전공과 부전공 학과에 별도로 취업계 신청을 해야하나요? 혹은매 과목별 교수님께 취업계를 요청해야 할까요?",1,조교 취업 문의 학기 취업 학기 학기 취업 학점 부 전공 학점 이 전공 부 전공 학과 별도 취업 신청 매 과목 별 교수 취업 요청 요
657,"안녕하세요 조교님 아무리 찾아도 안나와 답답한 마음에 질문 드려요..!?? 제가 2학기에 면학장학금 신청을 못해서 훕스드림 장학금을 노리고 있었는데, 제가 분명 그 공지가 12월정도에 뜬다고 봐서 넋 놓고 있었는데 이제와서 보니까 10월 말쯤에 신청을 이미 받았더라고요... 이 경우에 구제 받을수 있는 방법이 아예 없는지 궁금해요...!?? 큰일났어요 ㅠㅠㅠㅠㅠㅠㅠ",3,조교 안나 마음 질문 제 학기 면학 장학금 신청 훕스 드림 장학금 노리 제 분명 그 공지 넋 이제 보 말 신청 이 경우 구제 방법 아예 큰일
658,조교님 경영을 부전공으로 해놓고 후기이중을 나중에 신청하고 싶은데 후기이중도 티오가 있어야 할 수 있는건가요??,5,조교 경영 부 전공 후기 이중 나중 신청 후기 중도 티 수 가요
659,안녕하세요 조교님...재수강 관련 문의입니다. 2017-1에 들었던 교양 1과목을 2018-1에 다른 교양으로 재수강을 완료했는데과목 학수번호가 다를 경우 연결 신청해야 하는 것을깜빡하여 둘다 현재 성적 기록에 남아있는 것 같습니다...재수강 처리를 하면 이전 성적은 학점 계산에서 빠지는 게맞죠?2년 지난 상황에서 재수강 연결 처리를 하는 것이가능할까요? (성적 취득 현황에는 2018-1에 수강한 과목이 '재' 표기가 되어있기는 합니다.),6,조교 재수강 관련 문의 교양 과목 다른 교양 재수강 완료 과목 학 번호 경우 연결 신청 것 깜빡 현재 성적 기록 것 재수강 처리 이전 성적 학점 계산 게 지난 상황 재수강 연결 처리 것 요 성적 취득 현황 수강 과목 재 표기
660,"다음학기 복학해서 재수강 할 과목들 보고있는데1학년때 2,3 학점이던 언어 전공들이2019-2 기준으로 보니까 다 4학점 수업들이 됐네요...?2020-1 복학해서 재수강하면 학점 단위가 현재 단위로 플러스되서 계산되는거 맞나욥....??",8,다음 학기 복학 재수강 과목 학년 때 학점 언어 전공 기준 보 학점 수업 복학 재수강 학점 단위 현재 단위 플러스 계산 욥
661,안녕하세요 조교님. 혹시 부전공 신청날짜 언제인지 아시나요?? 안나왔으면 작년 기준으로 대략 언제인지 말씀해주세요!!,3,조교 혹시 부 전공 신청 날짜 언제 작년 기준 대략 언제 말씀
662,안녕하세요 조교님 혹시 정치외교학과 이중전공 면접 날짜가 언제 인가요,2,조교 혹시 정치 외교학 이중 전공 면접 날짜 언제
663,안녕하세요 질문이 있어서 글 남깁니다.9학기 이상부터는 신청 학점에 따라 등록금 감면 있는데 편입생도 해당되는건가요?9학기 이상 등록대상자라고 써 있어서 여쭤봅니다. 감사합니다.,1,질문 글 학기 이상 신청 학점 등록금 편입 생도 해당 가요 학기 이상 등록 대상자
664,질병 휴학은 휴학  제한 3년에 포함이 안 되나요? 그리고 입원의 경우에만 질병휴학으로 인정이 되는 건가요?,9,질병 휴학 휴학 제한 포함 안 입원 경우 질병 휴학 인정이 건가
665,안녕하세요 조교님! 항상 고생이 많으십니다 ㅠㅠ다름이 아니라 20년 1학기 국장을 신청한 상태인데성적기준은 직전학기를 기준으로 삼는다고 하더군요19년2학기 현재 현장실습으로 15학점 pass를 받을거같은데 이런 경우는 국가장학금 심사에 어떻게 적용되나요? 아니면 19년1학기 성적을 기준으로 국가장학금 선발에 적용이 될까요?,1,조교 항상 고생 학기 국장 신청 상태 성적 기준 직전 학기 기준 학기 현재 현장 실습 학점 를 경우 국가장학금 심사 적용 학기 성적 기준 국가장학금 선발 적용 요
666,안녕하세요 조교님!만약 8학기 이내에 졸업학점을 다 채웠으면(필수교양등 조건 충족)추가 학기를 등록할 수 없나요? 총학점을 높이기 위해서 3학점 정도만 등록을 한다던지...,8,조교 만약 학기 이내 졸업 학점 필수 교양 등 조건 충족 추가 학기 등록 수 학점 위해 학점 정도 등록
667,안녕하세요 조교님취업계 관련 글을 검색해보니 공채 또는 채용전환형 인턴 이어야 하고 재직증명서 그리고 4대보험이 되어야 한다는데..제가 진출하려는 분야가 프리랜서 분야여서 저런 재직증명서가 나올지 의문입니다.. 이럴경우 취업계를 받는게 거의  불가능한건가요?,0,조교 취업 관련 글 검색 공채 채용 전환 인턴 재직 증명서 보험 제 진출 분야 프리랜서 분야 저런 재직 증명서 의문 경우 취업 거의 가요
668,안녕하세요 조교님!이중전공 발표는 언제 나오나요?,2,조교 이중 전공 발표 언제
669,안녕하세요 조교님학칙에 수술로 인해서 시험 결석할 시 총장의 승인을 받아 추가시험을 받을 수 있다고 본것같은데 맞나요?그리고 기말고사도 추가시험이 가능한가요?,3,조교 학칙 수술 시험 결석 시 총장 승인 추가 시험 수 기말고사 추가 시험
670,"안녕하세요 조교님.질문이 있어 문의드립니다.항상 친절한 답변 감사합니다.현재 14학번 영어학 부전공을 하는 막학기 생입니다.졸업 시 부전공도 외국어인증 서류를 제출해야하는지제출해야한다면대한검정회 3급(2008 취득, 유효)을영어학과사무실에 제출하면 되는 것인지확인 차 여쭙고 싶습니다.감사합니다. 복 받으세요 !!",7,조교 질문 문의 항상 답변 현재 학번 어학 부 전공 막 학기 생 졸업 시 부전 공도 외국어 인증 서류 제출 제출 대한 검정 회 급 취득 유효 어학 사무실 제출 것 확인 차 복
671,"안녕하세요 조교님!현장실습 신청 공고란을 보는데, '(확정자)'라는게 옆에 붙어서 공고가 나오는 것을 봤습니다.현장실습 신청 공고란인데 왜 확정자만 신청하라고 뜨는건가요?이러한 경우는 해당 인턴십을 어떻게 지원해서 확정을 받은건가요?",5,조교 현장 실습 신청 란 확정 게 옆 공고 것 현장 실습 신청 란 왜 확정 자만 신청 가요 경우 해당 인턴십 지원 확정 가요
672,안녕하세요~ 이번에 취준하는 학생인데 현재 졸업과 졸업유예중 고민중에 있습니다. 졸시는 통과했는데  저는 그럼 토익점수만 제출하면 졸업이 가능한건가요?  혹시 언제까지 제출인지 알 수 있을까요..?,7,이번 취준하 학생 현재 졸업 졸업 유예 고민 통과 저 토익 점수 제출 졸업 가요 혹시 언제 제출 알 수
673,안녕하세요 조교님!!현재 1학년 1학기를 듣고 휴학을 한 상태입니다. 여기서 지금까지의 6개월 포함 1년 휴학을 해서 내년 2학기 복학 신청 후 1학년 2학기를 마친다면 전과 요건에 해당되는 건가요? 휴학 후 일년 중 중간 복학도 1학년 2학기로 판단이 되는 지 그래서 전과 요건에 충족하는 지가 궁금합니다!감사합니다 :),1,조교 현재 학년 학기 휴학 상태 여기 지금 개월 포함 휴학 내년 학기 복학 신청 후 학년 학기 전과 요건 해당 건가 휴학 후 년 중 중간 복학 학년 학기 판단 전과 요건 충족
674,휴학 최대 3년까지라 들었는데 늘리는거 가능한가요? 이미 1년했고 공무원 시험준비 때문에요.  3년초과되면 무조건 제적인가요?,0,휴학 최대 공무원 시험 준비 때문 무조건 제적
675,항상 고생하십니다.다름이 아니라2학기 17학점 듣고방학때 어학연수로 6학점 인정 받으면다음 학기 23학점 신청 가능한가요??궁금해서..,8,항상 고생 학기 학점 방학 때 어학 연수로 학점 인정 학기 학점 신청
676,에타 조교님 안녕하세요!계절학기 관련해서 질문이 있어서 글 남기게 됐습니다.현재 6학기 재학중인데 남은 2학기 동안 재수강 포함해 38학점 가량을 수강할 계획입니다.그래서 1학기 여름 계절 2학기를 들을 예정이었습니다.근데 혹시 졸업직전에 겨울 계절학기 까지 들을 수 있다면 학점 수강에 있어 여유가 생길거 같다는 생각이 들어 질문 하게 됐습니다.  졸업 직전 막학기 계절 수강까지 가능한가요?,1,에타 조교 계절 학기 관련 질문 글 현재 학기 재학 학기 동안 재수강 포함 학점 가량 수강 계획 학기 여름 계절 학기 예정 혹시 졸업 직전 겨울 계절 학기 수 학점 수강 여유 생각 질문 졸업 직전 막 학기 계절 수강
677,"안녕하세요, 조교님!휴학 후 바로 7+1로 복학 가능한지 질문 드립니다.항상 수고가 많으십니다!!",9,조교 휴학 후 바로 로 복학 질문 항상 수고
678,"조교님 안녕하세요!추가학기 관련해서 질문드릴게 있는데요1. 학점에 따른 추가학기 금액을 알고 싶습니다. 몇학점당 얼마를 내나요?2. 1개의 추가학기를 통해 졸업에 필요한 전공학점 등을 모두 이수를 해도, 그 외에 추가학기를 하나 더 다녀서 예전에 들었던 과목들을 재수강 하는 등의 방식이 가능한지 여쭙고 싶습니다!답변 미리 감사드립니당",1,조교 추가 학기 관련 질문 드릴 학점 추가 학기 금액 알 학점 얼마 개 추가 학기 통해 졸업 전공 학점 등 모두 이수 해도 그 외 추가 학기 하나 더 예전 과목 재수강 등 방식 답변 미리 감사
679,"조교님 수고가 많으십니다.제가 18년도에 편입한 16학번 편입생인데한학기더 수강안하고 바로 군휴학을 했습니다.그래서 20년 1학기때 복학하고,1학년 2학년 전필을 들어야하는데3학년 수강신청기간에 신청하면 되는건가요?",1,조교 수고 제 편입 학번 편입 생 학기 더 강안 바로 군 휴학 학기 때 복학 학년 학년 필 학년 수강신청 기간 신청 가요
680,"조교님 항상 감사합니다.-사이버강의를 재수강 하려고 할 때 같은 사이버강의만 가능한 것인지, 아니면 일반 교양강의로도 재수강연결이 가능한지 알고싶습니다",6,조교 항상 사이버 강의 재수강 때 사이버 강의 것 일반 교양 강의 도 재수강 연결
681,안녕하세요 조교님!늘 수고가 많으십니다실용외국어 대체 외국어연수평가원 겨울방학프로그램 이수 시1) 직전학기(19-2) 성적으로 편성 돼 막학기에 졸업 가능한지2) 필수출석 관련 취업유고결석이 몇일동안 가능한지여쭙고 싶습니다..ㅠㅠ 감사합니다.,1,조교 늘 수고 실용 외국어 대체 외국어 연수 평가원 겨울방학 프로그램 이수 시 직전 학기 성적 편성 막 학기 졸업 필수 출석 관련 취업 유고 결석 동안
682,"안녕하세요 조교님!현재 3학년 2학기 재학중인 학생입니다.올해 1학기에 이중변경을 하였으나, 적성에 맞지 않아 다시 원래 이중전공으로 변경을 하고 싶습니다.이중변경은 1회로 횟수가 제한되는 것으로 알고 있기에 이전 이중전공을 부전공으로 다시 신청한뒤 차후에 이중전공으로 올리는 방법을 생각하고 있는데 가능한 방법인가요?",2,조교 현재 학년 학기 재학 학생 올해 학기 이중 변경 적성 다시 원래 이중 전공 변경 이중 변경 횟수 제한 것 알 이전 이중 전공 부 전공 다시 신청 뒤 차후 이중 전공 방법 생각 방법
683,조교님 물어볼게 있어 글 써봅니다. 다름이 아니라 이번 학기는 휴학처리가 된 상태이고 내년 2월달쯤에 자퇴를 할 예정인데요. 혹시 방문하지 않고 서류를 팩스로만 보내며 휴학처리를 할 수 있나요?? 현재 서울이 아닌데 휴학때문에 가기가 너무 부담스러워서요ㅠㅠ,9,조교 글 이번 학기 휴학 처리 상태 내년 자퇴 예정 요 혹시 방문 서류 팩스 로만 휴학 처리 수 현재 서울 휴학 때문 가기
684,"안녕하세요 조교님 맨날 보면서 감탄하고 너무 감사하게 생각하고 있습니다... 제가 에타 어플을 살려두는 이유는 바로 이 게시판 때문이죠 하핳.  조교님이 학교 행정직원 하셔야 되는거 아닐까 싶어요 진짜 아니 어떻게 이렇게 잘 아시지 이게 가능한건가 혹시 학생 아니시고 진짜 직원분이신가 한때 너무 궁금했어요..... 왠만한거 여기서 검색하면 다 있고,.. 전에 진짜 저한테는 중요했던 일로 도움도 받아봐서 이 게시판의 존재와 조교님의 답변에 가슴을 쓸어내린적도 있네요 ㅋㅋㅋ 정말 이 게시판에 글이 올라와도 알람도 안 오실텐데 일일히 확인하시고 답도 친절하고 상세하게 달아주시고..  귀찮고 번거롭고 하다가 그만두실 법도 한데 정말 꾸준히...그냥 봉사인데 대단하시고 감사합니다 ㅠㅠㅠㅠㅠ 기업에서 이거 봉사 스팩으로 쳐줘야 하는거 아닐까요?? 암튼... 그냥 한번 말씀드리고 싶었어요!!!! 에타조교님의 노고에 무한한 감사를 드리며 2019년 얼마 안 남았는데 마무리 잘 하시고 행복한 2020년 맞이하세요! ( 게시판 의도에 맞지 않는 글인거 알기 때문에 밤에 자삭 하겠습니다...??)",3,조교 감탄 생각 제 에타 어플 이유 바로 이 게시판 때문 조교 학교 행정 직원 진짜 아시 이 건가 혹시 학생 진짜 직원 여기 검색 전 진짜 테 일로 도움 이 게시판 존재 조교 답변 가슴 적도 정말 이 게시판 글 알람 안 일일 확인 답 상세 법도 정말 그냥 봉사 기업 거 봉사 스팩 요 그냥 한번 에타 조교 노고 무한 감사 얼마 안 마무리 맞이 게시판 의도 글 때문 밤 자삭
